Status,Taker,Name,Notes,Agency,DocType,Id
有條件通…,高俊璿,竹北市世興段52、54地號2筆土地綜合大樓新建工程,說明書定稿本,新竹縣,說明書,1000041E
有條件通…,潘忠政,榮剛材料科技股份有限公司柳營廠建廠計畫環境影響說明書,,臺南縣,說明書,1000041L
不應開發…,唐淑蓉,卓溪鄉興辦社區體育場環境影響說明書,認定不應開發,花蓮縣,說明書,1000041P
有條件通…,曾文慧,新竹市光武段汽車旅館新建工程,,新竹市,說明書,1000041S
有條件通…, ,「高雄市左營區福山段349等5筆地號店鋪、集合住宅新建工程」環境影響說明書,,高雄市,說明書,1000041X
審核修正…,薛富美,豐富五峰旗旅館整體開發計畫環境現況差異分析及對策檢討報告暨環境影響差異分析報告書,本件書件為定稿本,宜蘭縣,其他,1000038C
審查中,顏佳慧,臺北縣政府八里下罟子區域性垃圾衛生掩埋場環境影響說明書第二次變更內容對照表,,新北市,環境調查報告,1000037B
其他,郭殷碩,「大進精工股份有限公司擴大變更毗鄰土地為工業區」環境影響說明書變更內容對照表,,臺南縣,變更內容對照表,1000034L
審核修正…,譚仲萍,屏安醫院大同分院擴建工程變更內容對照表,,屏東縣,變更內容對照表,1000034N
審核修正…,唐淑蓉,花蓮縣中區區域性垃圾衛生掩埋場工程環境影響差異分析報告,定稿本,花蓮縣,差異分析報告,1000033P
審核修正…,潘忠政,台灣蘭花生物科技園區第三期土地開發環境影響說明書-環境影響差異分析報告,,臺南市,差異分析報告,1000033V
有條件通…,周韋儒,亞東石化股份有限公司觀音二廠開發計畫環境影響說明書(定稿本),1.本案係103年補傳之資料，繳費日期以登記在案之第一次提案審查日期表示。,桃園縣,說明書,1000031D
有條件通…,高俊璿,豐邑建設竹北市莊敬段713地號店舖住宅大樓新建工程,說明書定稿本,新竹縣,說明書,1000031E
有條件通…,林芳津,銅鑼科學園區北側住宅區開發計畫環境影響說明書,,苗栗縣,說明書,1000031F
有條件通…,蘇君紋,清水區第二公墓興建第二納骨堂,,臺中縣,說明書,1000031G
有條件通…,莊惠如,「基隆市安樂區內寮武林自辦市地重劃計畫」環境影響說明書,,基隆市,說明書,1000031R
審查中,曾文慧,盛虹東門城飯店商業大樓新建工程,,新竹市,說明書,1000031S
有條件通…,姜樹成,「午陽建設股份有限公司旅館新建工程」環境影響差異分析報告,,臺中市,說明書,1000031T
有條件通…,林志芳,臺北文化體育園區整體規劃案-體育園區(重新辦理環境影響評估)替代方案環境影響說明書,,臺北市,說明書,1000031W
有條件通…, ,「高雄市前金區前金段65-2、65-5、65-6等三筆地號興建工程」環境影響說明書,,高雄市,說明書,1000031X
審核修正…,譚仲萍,「屏東縣林邊溪上游人工湖設置工程計畫環境現況差異分析及對策檢討與環境影響差異分析報告書,,屏東縣,其他,1000028N
審查中,張秀慧,新店都市計劃原部份工七工業區變更為商業及住宅區環境影響說明書變更內容對照表(第6次變更),,新北市,環境調查報告,1000027B
審核修正…,薛富美,宜蘭縣員山鄉中華村普恩宮開發計畫環境影響說明書變更內容對照表,本件書件為定稿本,宜蘭縣,變更內容對照表,1000024C
審核修正…,周韋儒,桃園市同德段42地號集合住宅暨一般事務所新建工程環境影響說明書變更內容對照表,1.本案係103年補傳之資料，繳費日期以登記在案之第一次提案審查日期表示。,桃園縣,變更內容對照表,1000024D
審核修正…, ,仁武垃圾資源回收(焚化)廠環境影響評估告書變更內容對照表,,高雄市,變更內容對照表,1000024X
審核修正…,唐淑蓉,花蓮縣壽豐鄉豐坪段垃圾衛生掩埋場工程環境影響差異分析報告,定稿本,花蓮縣,差異分析報告,1000023P
審核修正…,莊惠如,「基隆培德路住宅社區建築計畫變更」第四次環境影響差異分析報告,,基隆市,差異分析報告,1000023R
審核修正…,郭殷碩,愛文山土石方資源堆置場設置開發計畫環境影響差異分析報告,,臺南市,差異分析報告,1000023V
審核修正…,林志芳,中國信託新總行大樓新建工程第二次環境影響差異分析報告,,臺北市,差異分析報告,1000023W
有條件通…,高俊璿,德鑫建設竹北市莊敬段715地號店舖住宅大樓新建工程,說明書定稿本,新竹縣,說明書,1000021E
有條件通…,賴易正,台灣農林苗栗銅鑼九湖段土地工商綜合區開發案環境影響說明書,,苗栗縣,說明書,1000021F
審查中,蘇君紋,台中市霧峰區亞洲自辦農村社區土地重劃開發計畫,環說書為初稿,臺中縣,說明書,1000021G
有條件通…,潘忠政,臺南市七股區篤加段170-126地號等21筆土地申請編定工業區(凱田工業區開發案)環境影響說明書,,臺南縣,說明書,1000021L
有條件通…,曾文慧,新竹市東區前溪自辦農村社區土地重劃案,,新竹市,說明書,1000021S
有條件通…,楊素禎,「泰偉金門工商綜合區開發案」環境影響說明書,,金門縣,說明書,1000021Z
審查中,謝宏松,潤泰創新國際股份有限公司三芝鄉後厝段土地整體開發計畫環境監測計畫變更內容對照表,,新北市,環境調查報告,1000017B
審核修正…,薛富美,五結住宅整體開發計畫案環境影響說明書變更內容對照表,本件書件為定稿本,宜蘭縣,變更內容對照表,1000014C
審核修正…,賴易正,廣源科技工業園區工業用地開發第三次變更內容對照表,,苗栗縣,變更內容對照表,1000014F
審核修正…,陳正光,榮寶企業股份有限公司資源再生廠環境影響說明書變更內容對照表,,彰化縣,變更內容對照表,1000014H
審核修正…,譚仲萍,屏安醫院大同分院擴建工程環境影響說明書變更內容對照表,,屏東縣,變更內容對照表,1000014N
其他,郭殷碩,嘉益工業股份有限公司申請工業區擴大編定計畫環境影響說明書環境影響差異分析報告(第三次變更),官田鋼鐵股份有限公司因重新檢討變更內容，101年4月3日101（官）字第0405號函撤回本案差異分析報告，本府101年4月18日府環企字第1010327456號函復同意。,臺南縣,差異分析報告,1000013L
審核修正…,唐淑蓉,花蓮縣秀林鄉陶樸閣垃圾衛生掩埋場興建計畫環境影響差異分析報告,,花蓮縣,差異分析報告,1000013P
審核修正…,莊惠如,「基隆市優泉小鎮住宅社區開發案第三次計畫變更環境影響差異分析報告」,,基隆市,差異分析報告,1000013R
審核修正…,姜樹成,台中市西區後?子段235-84等2筆地號集合住宅新建工程環評影響說明書環境差異分析,定稿本,臺中市,差異分析報告,1000013T
審核修正…,吳俊達,國泰置地廣場新建工程變更設計環境影響差異分析報告,,臺北市,差異分析報告,1000013W
審核修正…,楊素禎,「金門大橋興建工程計畫」環境影響差異分析報告,,金門縣,差異分析報告,1000013Z
有條件通…,周韋儒,堡富興業股份有限公司乙級廢棄物處理機構擴增處理量,1.本案係103年補傳之資料，繳費日期以登記在案之第一次提案審查日期表示。,桃園縣,說明書,1000011D
有條件通…,蘇君紋,全精英事業有限公司乙級廢棄物處理機構開發計畫,環說書為定稿,臺中縣,說明書,1000011G
有條件通…,張秀靜,中明觀光遊樂區環境影響說明書,本案業經本府環境影響評估委員會101年03月21日會議審核有條件通過,南投縣,說明書,1000011I
審查中, ,雲林縣四湖鄉新庄公墓公園化環境影響評估說明書,,雲林縣,說明書,1000011J
有條件通…,曾文慧,新竹市港南段116、116-1、116-2地號自擬細部計畫（住宅區）開發案環境影響說明書,,新竹市,說明書,1000011S
有條件通…,盧曉鈴,「嘉義市湖子內區段徵收環保用地(含焚化灰渣掩埋場)開發計畫」環境影響說明書（修訂一版）審查會會議紀錄,本案有條件通過環境影響評估審查，開發單位應依下列事項辦理：,嘉義市,說明書,1000011U
有條件通…,郭殷碩,台南市安南區土城工業區(工8)開發計畫環境影響說明書,,臺南市,說明書,1000011V
有條件通…, ,"高雄世界貿易展覽會議中心
環境影響說明書",,高雄市,說明書,1000011X
審核修正…,石秉鑫,臺北港第二期工程通盤檢討(北淤沙區、南外廓防波堤、親水遊憩區及東碼頭區公務碼頭等整建工程)環境影響說明書第二次變更內容對照表,本書件為定稿本,環保署,變更內容對照表,0991824A
有條件通…,何文淵,國家生技研究園區開發計畫環境影響說明書,,環保署,說明書,0991811A
審核修正…,黃珮瑜,彰化濱海工業區開發計畫環境影響調查報告書,本案與1002006A此案合併召開會議；本書件為確認本,環保署,環境調查報告,0991807A
審查中,邱景昆,國家運動選手訓練中心整建計畫環境影響說明書變更內容對照表,本書件為定稿本,環保署,變更內容對照表,0991794A
審核修正…,鄭惠文,台肥遷建至台中港營運投資計畫環境影響差異分析報告（第二次修正）,,環保署,差異分析報告,0991783A
審查中,溫育勇,水美工程企業股份有限公司觀音資源回收廠環境影響差異分析報告,"1.本書件為修訂本 2. 2011/05/30會議資料僅意見回復內容,相關補正資料詳見本書件目錄",環保署,差異分析報告,0991773A
審核修正…,張同婉,嶺東科技大學第二校區開發計畫環境影響差異分析報告（第四次環評變更）,,環保署,差異分析報告,0991763A
審核修正…,石秉鑫,行政院衛生署玉里醫院溪口復健園區建院計畫環境影響說明書變更內容對照表,本書件為定稿本,環保署,變更內容對照表,0991754A
審核修正…,張盈瑄,康寧大學環境影響說明書變更內容對照表(原立德),本書件為定稿本,環保署,變更內容對照表,0991744A
審核修正…,石秉鑫,中國石油股份有限公司永安廠北堤新建工程（含站區設施擴建）環境影響說明書第一次變更內容對照表,本書件為定稿本,環保署,變更內容對照表,0991734A
審核修正…,石秉鑫,東西向快速公路八里新店線八里五股段環境影響說明書變更內容對照表,本書件為定稿本,環保署,變更內容對照表,0991724A
有條件通…,鄭惠文,桃園科技工業園區第二期開發計畫環境影響說明書,,環保署,說明書,0991711A
有條件通…,張同婉,高鳳數位內容學院開發計畫變更案環境影響說明書,,環保署,說明書,0991701A
審核修正…,石秉鑫,友隆企業股份有限公司台濟採字第5299號礦區申請核定及變更核定礦業用地環境影響說明書變更負責人及營業所,本件係變更負責人及營業所地址,環保署,其他,0991698A
審核修正…,石秉鑫,建民水庫可行性規劃環境影響評估報告書變更內容對照表暨變更審查結論,本書件為定稿本,環保署,變更內容對照表,0991684A
徵詢意見…,張同婉,放射性廢棄物管理政策評估說明書,本書件為修正本,環保署,政策評估說明書,0991670A
審核修正…,張盈瑄,豐德天然氣發電廠興建計畫環境影響說明書(增建備品倉庫及太陽光電系統)變更內容對照表,本書件為定稿本,環保署,變更內容對照表,0991664A
有條件通…,張同婉,鹿林前山兩公尺望遠鏡天文台與周邊設施工程環境影響說明書,,環保署,說明書,0991651A
審核修正…,邱景昆,嘉義縣馬稠後工業區開發計畫環境影響評估報告書變更內容對照表,本書件為定稿本,環保署,變更內容對照表,0991644A
審核修正…,張盈瑄,臺中港南填方區(Ι)圍堤及航道浚深拓寬工程計畫環境影響說明書變更內容對照表,本書件為定稿本,環保署,變更內容對照表,0991634A
其他,邱景昆,臺南縣柳營科技工業區開發計畫第五次變更內容對照表(局部調整土地使用配置),本書件為定稿本,環保署,變更內容對照表,0991624A
審核修正…,溫育勇,臺北都會區大眾捷運系統後續發展路網環境影響評估松山線第二次環境影響差異分析報告,,環保署,差異分析報告,0991613A
有條件通…,何文淵,新北市新店禾豐二段162、163、直潭段塗潭小段274-2等三筆地號別墅新建工程環境影響說明書,,環保署,說明書,0991601A
有條件通…,楊智凱,苗栗縣出磺坑地區優質環境改造計畫－客家桃花源環境影響說明書,,環保署,說明書,0991591A
審核修正…,石秉鑫,淡水河系污水下水道系統營運期間環境品質監測計畫變更內容對照表,本書件為定稿本,環保署,變更內容對照表,0991584A
審核修正…,何文淵,慈濟綜合醫院台中分院整體開發計畫第三次環境影響差異分析報告,,環保署,差異分析報告,0991573A
審核修正…,何文淵,華亞汽電股份有限公司汽電共生機組新建計畫第二次環境影響差異分析報告,,環保署,差異分析報告,0991563A
審核修正…,石秉鑫,臺灣科技大學基隆校區開發計畫環境影響說明書變更內容對照表,本書件為定稿本,環保署,變更內容對照表,0991554A
審核修正…,何文淵,離島式基礎工業區石化工業綜合區長春關係企業（長春石油化學股份有限公司、大連化學工業股份有限公司、長春人造樹脂廠股份有限公司）麥寮廠第五次變更計畫環境影響差異分析報告,,環保署,差異分析報告,0991543A
審核修正…,張同婉,財團法人奇美醫院柳營分院醫療園區整體開發計畫第三次變更（醫療區擴床計畫與配置調整）環境影響差異分析報告,,環保署,差異分析報告,0991533A
審核修正…,徐國豐,大林廠興建重油轉化工場暨媒組工場擴增計畫環境影響差異分析報告,,環保署,差異分析報告,0991523A
審核修正…,石秉鑫,高速鐵路環境影響評估報告變更內容對照表-營運階段沿線噪音及振動監測計畫變更,本書件為定稿本,環保署,變更內容對照表,0991514A
審核修正…,徐國豐,新竹科學工業園區龍潭基地（替代方案）開發計畫第五次變更環境影響差異分析報告,,環保署,差異分析報告,0991503A
審核修正…,石秉鑫,淡水小坪頂社區整體開發建築計畫環境影響評估報告書第二次變更內容對照表,本書件為定稿本,環保署,變更內容對照表,0991494A
審核修正…,石秉鑫,臺鐵電聯車富岡基地興建案環境影響說明書變更內容對照表,本書件為定稿本,環保署,變更內容對照表,0991484A
審核修正…,邱景昆,台南科技工業區開發計畫環境影響評估報告書第二次變更內容對照表,本書件為定稿本,環保署,變更內容對照表,0991474A
審核修正…,鄭惠文,宜蘭大理石股份有限公司宜大石礦公界暨毗鄰區域申請核定開採礦石計畫環境影響說明書環境影響差異分析報告,,環保署,差異分析報告,0991463A
審核修正…,張同婉,淳品台北港化油品儲運中心儲運化油品變更第二次環境影響差異分析報告暨審查結論變更,,環保署,差異分析報告,0991453A
有條件通…,張瑞芸,台9線蘇花公路山區路段改善計畫（蘇澳～東澳、南澳～和平、和中～大清水）,,環保署,說明書,0991441A
審核修正…,徐國豐,民間機構參與福隆濱海旅館區之興建暨營運案環境影響差異分析報告,,環保署,差異分析報告,0991433A
審查中,陳妙玲,財團法人佛教慈濟綜合醫院大林分院環境影響說明書環境監測計畫變更內容對照表,本書件為初稿本,環保署,變更內容對照表,0991424A
有條件通…,鄭惠文,台中市東山路縣道129線(D標末至中興嶺段)拓寬工程環境影響說明書,,環保署,說明書,0991411A
徵詢意見…,溫育勇,砂石開發供應方案政策評估說明書,本書件為初稿本,環保署,政策評估說明書,0991400A
審核修正…,陳妙玲,貝民公司台中港建廠計畫環境影響說明書第二次變更內容對照表,本書件為定稿本,環保署,變更內容對照表,0991394A
審核修正…,石秉鑫,台北商港物流倉儲區填海造地計畫環境影響評估報告書變更內容對照表,本書件為定稿本,環保署,變更內容對照表,0991384A
審核修正…,陳妙玲,老坑社區環境影響評估報告書第二次變更內容對照表,本書件為定稿本,環保署,變更內容對照表,0991374A
審核修正…,溫育勇,屏東縣內埔鄉隘寮溪水門村新生地開發計畫環境影響說明書變更內容對照表暨變更審查結論,,環保署,變更內容對照表,0991364A
審核修正…,溫育勇,國立台灣大學醫學院附設醫院兒童醫療大樓新建工程營運變更環境影響差異分析報告,,環保署,差異分析報告,0991353A
審核修正…,鄭惠文,台灣地區西部走廊東西向快速公路建設計畫觀音-大溪線環境影響說明書第一次環境影響差異分析報告,,環保署,差異分析報告,0991343A
審核修正…,溫育勇,第二高速公路後續計畫環境影響評估報告新竹-南投段環境影響差異分析報告（增設南投交流道工程）,,環保署,差異分析報告,0991333A
其他,陳妙玲,臺中市污水下水道系統整體規劃環境影響說明書變更內容對照表,本書件為初稿本,環保署,變更內容對照表,0991324A
通過審查…,楊智凱,駿都大飯店開發計畫環境影響說明書,,環保署,說明書,0991311A
不應開發…,楊智凱,后里第二淨水場環境影響說明書,本書件為修訂本,環保署,說明書,0991301A
有條件通…,溫育勇,宏亞旅館開發案環境影響說明書,,環保署,說明書,0991291A
審核修正…,張盈瑄,北部液化天然氣接收站新建計畫環境影響說明書審查結論一變更暨變更內容對照表,本書件為定稿本,環保署,變更內容對照表,0991284A
不同意變更,陳妙玲,中區事業廢棄物綜合處理中心環境影響說明書變更內容對照表,本書件為初稿本,環保署,變更內容對照表,0991274A
審核修正…,石秉鑫,金門地區海水淡化環境影響說明書第二次變更內容對照表,本書件為定稿本,環保署,變更內容對照表,0991264A
有條件通…,何文淵,西濱快速公路後續建設計畫白沙屯至南通灣段新建工程計畫環境影響說明書,,環保署,說明書,0991251A
審核修正…,石秉鑫,核能四廠第一、二號機發電計畫調整水源供應變更內容對照表,本書件為定稿本,環保署,變更內容對照表,0991244A
審核修正…,陳彥男,「遠雄海洋公園開發事業計畫」及「花蓮遠雄悅來飯店開發事業計畫」環境調查報告書,,環保署,環境調查報告,0991237A
作成徵詢…,楊智凱,鋼鐵工業政策評估說明書,本書件為修訂本,環保署,政策評估說明書,0991220A
審核修正…,邱景昆,中國石油化學工業開發股份有限公司第三套已內醯胺製造計畫環境說明書變更內容對照表,不實施開發行為,環保署,變更內容對照表,0991214A
審核修正…,石秉鑫,興達發電廠海水淡化工程計畫環境影響說明書變更內容對照表,,環保署,變更內容對照表,0991204A
退件/撤銷,鄭惠文,陽明山國家公園馬槽遊憩區（東區）陽明山日月農莊改建案環境影響說明書,本書件為初稿本；本案開發單位未於期限內補正，本署依環境影響評估法第13條之1規定，函請陽明山國家公園管理處駁回開發行為許可之申請。,環保署,說明書,0991191A
審核修正…,邱景昆,麥寮汽電股份有限公司六輕四期擴建計畫環境影響說明書第二次變更內容對照表,本書件為定稿本,環保署,變更內容對照表,0991184A
不同意變更,陳妙玲,財團法人敬德護理之家籌設案環境影響說明書第一次變更內容對照表,本書件為初稿本,環保署,變更內容對照表,0991174A
有條件通…,何文淵,嘉新水泥股份有限公司臺濟採字第5454號礦區申請核定及變更核定礦業用地計畫和平礦場開發計畫環境影響說明書,,環保署,說明書,0991161A
審核修正…,石秉鑫,花蓮縣鳳林休閒渡假園區開發計畫環境影響說明書變更內容對照表暨變更審查結論,,環保署,變更內容對照表,0991154A
審核修正…,陳妙玲,變更林口特定區計畫(部分保護區變更為零星工業區)環境影響說明書第二次變更內容對照表,本書件為定稿本,環保署,變更內容對照表,0991144A
審核修正…,張盈瑄,國立高雄大學預定地環境影響說明書第五次變更內容對照表,本書件為定稿本,環保署,變更內容對照表,0991134A
審查中,陳妙玲,馬偕醫護管理專科學校校區整體開發建築計畫環境監測計畫變更內容對照表,本書件為初稿本,環保署,變更內容對照表,0991124A
審核修正…,陳妙玲,月眉育樂世界開發案環境影響評估報告書第2次變更內容對照表,本書件為定稿本,環保署,變更內容對照表,0991114A
徵詢意見…,溫育勇,「新訂機場捷運坑口車站(A11車站計畫區)」、「擴大大園都市計畫(機場捷運A15車站計畫區)」及「新訂機場捷運橫山車站(A16車站計畫區)」政策環境影響評估說明書,本書件為初稿本,環保署,政策評估說明書,0991100A
有條件通…,溫育勇,中興新村高等研究園區開發計畫環境影響說明書,,環保署,說明書,0991091A
審核修正…,鄭惠文,中山高速公路新竹-員林段拓寬工程計畫增設頭屋交流道環境影響差異分析報告,,環保署,差異分析報告,0991083A
審核修正…,石秉鑫,高雄港洲際貨櫃中心計畫環境影響評估報告書第三次變更內容對照表,本書件為定稿本,環保署,變更內容對照表,0991074A
有條件通…,溫育勇,國家會展中心(南港展覽館擴建)新建工程暨附屬工程環境影響說明書,,環保署,說明書,0991061A
有條件通…,何文淵,利東工礦股份有限公司為所領台濟採字第4793號大理石、白雲石礦採礦權申請核定暨變更核定礦業用地環境影響說明書,,環保署,說明書,0991051A
審核修正…,陳妙玲,台鐵高雄-屏東潮州捷運化建設計畫西勢車站配置變更內容對照表,,環保署,變更內容對照表,0991044A
有條件通…,鄭惠文,國立體育大學田徑場新建工程環境影響說明書,,環保署,說明書,0991031A
審核修正…,何文淵,大台北華城莫扎特社區南區規劃案環境影響差異分析報告,,環保署,差異分析報告,0991023A
審核修正…,陳妙玲,國立臺灣體育學院嘉義校區環境影響說明書第二次變更內容對照表,,環保署,變更內容對照表,0991014A
審核修正…,何文淵,湖山水庫工程計畫第3次環境影響差異分析報告,,環保署,差異分析報告,0990993A
審核修正…,張同婉,苗栗縣後龍鎮設置風力發電廠興建計畫環境影響說明書審查結論變更暨環境影響差異分析報告,,環保署,差異分析報告,0990983A
退件/撤銷,何文淵,北台科技園區開發計畫（替代方案）環境影響說明書,本書件為修訂本；本案依據102年4月11日環署綜字第1020029177號函駁回。,環保署,說明書,0990971A
審核修正…,溫育勇,安平漁港舊港口重建計畫開發計畫變更環境影響差異分析報告,,環保署,差異分析報告,0990963A
審核修正…,何文淵,桃園科技工業園區開發計畫環境影響差異分析報告,,環保署,差異分析報告,0990953A
審核修正…,鄭惠文,私立光華高工遷校新建工程開發計畫環境影響差異分析報告(第二次變更),,環保署,差異分析報告,0990943A
其他,石秉鑫,基隆市東岸聯外道路工程環境影響評估報告書第四次變更內容對照表,"開發單位未繳費,本書件為初稿本",環保署,變更內容對照表,0990934A
審核修正…,陳妙玲,陽泰華城開發計畫環境影響評估報告書環境監測計畫之變更內容對照表,本書件為定稿本,環保署,變更內容對照表,0990924A
審核修正…,張瑞芸,聯華電子股份有限公司力行廠區擴增產能計畫環境影響說明書變更內容對照表暨審查結論變更,,環保署,變更內容對照表,0990914A
審核修正…,張瑞芸,聯華電子股份有限公司Fab-8F晶圓廠環境影響說明書變更內容對照表暨審查結論變更,,環保署,變更內容對照表,0990904A
審核修正…,張瑞芸,聯華電子股份有限公司Fab-8E晶圓廠環境影響說明書變更內容對照表暨審查結論變更,,環保署,變更內容對照表,0990894A
審核修正…,張瑞芸,晶元光電股份有限公司及歐西普亞洲股份有限公司環境影響說明書變更內容對照表暨審查結論變更,,環保署,變更內容對照表,0990884A
審核修正…,張瑞芸,敦南科技股份有限公司新竹分公司晶圓廠環境影響說明書變更內容對照表暨審查結論變更,,環保署,變更內容對照表,0990874A
審核修正…,張瑞芸,高平磊晶科技股份有限公司新建廠環境影響說明書變更內容對照表暨審查結論變更,,環保署,變更內容對照表,0990864A
