Status,Taker,Name,Notes,Agency,DocType,Id
,商維庭,範疇界定:大故宮計畫環境影響評估報告書,範疇界定會議資料請至本署環評開發論壇下載：http://atftp.epa.gov.tw/EIAforum/Default.aspx?page=NewsList,環保署,評估報告書,1030772A
審核修正…,邱景昆,嘉義縣馬稠後產業園區開發計畫環境影響評估報告書第3次變更內容對照表,本書件為初稿本,環保署,變更內容對照表,1030764A
審核修正…,邱景昆,國立臺南藝術大學環境影響評估報告書第4次變更內容對照表,,環保署,變更內容對照表,1030714A
審查中,商維庭,大林煉油廠油品脫硫計畫第二次環境影響差異分析報告,本書件為初稿本,環保署,差異分析報告,1030673A
審查中,羅佩瑩,國立臺灣大學雲林分部校園整體開發第二次環境影響差異分析報告,本書件為初稿本,環保署,差異分析報告,1030653A
審查中,張同婉,屏東車城國際觀光旅館開發計畫環境影響差異分析報告,本書件為初稿本,環保署,差異分析報告,1030633A
審查中,商維庭,國立清華大學宜蘭園區第二次環境影響差異分析報告,本書件為初稿本,環保署,差異分析報告,1030623A
審查中,邱景昆,東西向快速公路八里新店線(五股-板橋段)環境影響說明書變更內容對照表,本書建為初稿本,環保署,變更內容對照表,1030614A
審查中,邱景昆,臺北港南外堤內側碼頭區填海造陸開發計畫環境影響說明書第二次變更內容對照表(土方填築區位調整),本書件為初稿本,環保署,變更內容對照表,1030604A
審查中,楊智凱,臺灣桃園國際機場聯外捷運系統桃園都會區大眾捷運系統規劃第四次環境影響差異分析報告（桃園環北轉運站）,本書件為初稿本,環保署,差異分析報告,1030593A
審查中,邱景昆,六輕相關計畫台塑公司丙烯腈廠變更內容對照表,本書件為初稿本,環保署,變更內容對照表,1030574A
審查中,陳彥男,雲端國際觀光旅館環境影響說明書,本書件為初稿本；補正期限：103年8月31日。,環保署,說明書,1030551A
審查中,張同婉,臺北港第二期工程（臺北港第二散雜貨儲運中心E12- 3基地增設第二組預拌混凝土廠）環境影響差異分析報告,本書件為初稿本,環保署,差異分析報告,1030543A
審查中,陳彥男,和平工業專用港開發計畫因應對策,本書件為初稿本；補正期限：103年8月31日。,環保署,因應對策,1030536A
審查中,邱景昆,臺北港第二期工程(東16號碼頭及A11道路離港匝道新建工程)環境影響差異分析報告第1次變更內容對照表,本書件為初稿本,環保署,變更內容對照表,1030524A
審查中,邱景昆,中央研究院跨領域科技研究大樓、溫室、學人寄宿舍(1)、學人寄宿舍(2)等新建工程開發環境影響說明書-跨領域科技研究大樓申請停止環境監測計畫變更內容對照表,本書件為初稿本,環保署,變更內容對照表,1030514A
審查中,邱景昆,中國科技大學新竹校區開發案環境影響說明書第三次變更內容對照表,本書件為初稿本,環保署,變更內容對照表,1030504A
審查中,邱景昆,佛光大學建校計畫環境影響評估報告書變更內容對照表,本書件為初稿本,環保署,變更內容對照表,1030494A
審查中,張同婉,臺中市精密機械科技創新園區開發計畫第六次環境影響差異分析報告,本書件為初稿本,環保署,差異分析報告,1030483A
審查中,張同婉,六輕四期擴建計畫第九次環境影響差異分析報告,本書件為初稿本,環保署,差異分析報告,1030473A
審查中,張同婉,六輕相關計畫農業渠道灌溉尾水再利用案未完成之因應對策,本書件為初稿本,環保署,因應對策,1030466A
審查中,陳彥男,遠雄健康生活園區開發案第二次環境影響差異分析報告,本書件為確認本,環保署,差異分析報告,1030433A
審核修正…,邱景昆,高雄港洲際貨櫃中心計畫環境影響評估報告書第四次變更內容對照表,本書件為定稿本,環保署,變更內容對照表,1030424A
審查中,邱景昆,台中市大安區、大甲區設置風力發電廠興建計畫第二次變更內容對照表,本書件為修訂本,環保署,變更內容對照表,1030414A
審查中,劉馥萱,龍港風力發電機組開發計畫環境影響差異分析報告,本書件為初稿本,環保署,差異分析報告,1030403A
審查中,張同婉,嶺東科技大學第二校區開發計畫環境影響差異分析報告書（第五次變更）,本書件為初稿本,環保署,差異分析報告,1030393A
審查中,陳彥男,彰濱工業區事業廢棄物資源回收處理廠暨中區事業廢棄物綜合處理中心第四次環境影響差異分析報告,本署件為初稿本,環保署,差異分析報告,1030383A
審查中,邱景昆,大鵬灣國家風景區(BOT)開發計畫環境影響說明書第五次變更內容對照表,本書件為初稿本,環保署,變更內容對照表,1030374A
審查中,張同婉,六輕四期擴建計畫第八次環境影響差異分析報告,本書件為初稿本,環保署,差異分析報告,1030363A
審查中,邱景昆,台中發電廠第九、十號機發電計畫環境影響說明書環境監測變更內容對照表,本書件為初稿本,環保署,變更內容對照表,1030354A
審查中,邱景昆,台26線安朔至港口段公路整體改善計畫環境影響評估報告書第3次變更內容對照表(安朔至旭海段第5-6標停止營運期間環境監測計畫),本書件為初稿本,環保署,變更內容對照表,1030344A
審查中,劉馥萱,華亞汽電股份有限公司汽電共生機組新建計畫第三次環境影響差異分析報告,本書件為初稿本,環保署,差異分析報告,1030333A
審查中,劉馥萱,中山高速公路員林至高雄段拓寬工程計畫環境影響說明書第6次環境差異分析報告（增設臺南交流道北上出口匝道）,本書件為初稿本,環保署,差異分析報告,1030323A
審查中,張同婉,苗栗縣後龍鎮設置風力發電廠興建計畫第二次環境影響差異分析報告,本書件為初稿本,環保署,差異分析報告,1030303A
進入二階…,陳彥男,澎防部(莒光營區)遷建工程案環境影響說明書,本書件為初稿本,環保署,說明書,1030291A
審查中,陳彥男,禾和二區興建計畫案環境影響差異分析報告暨變更審查結論,本書件為修訂本,環保署,差異分析報告,1030283A
審查中,邱景昆,第二高速公路後續計畫新營屏東段(配合高屏地區及經濟部吉洋人工湖砂石運輸道路工程)環境影響差異分析報告書第二次變更內容對照表,本書件為初稿本,環保署,變更內容對照表,1030274A
審查中,楊智凱,花蓮理想渡假村開發計畫環境影響差異分析報告,本書件為初稿本,環保署,差異分析報告,1030263A
審查中,邱景昆,國道二號拓寬工程環境影響說明書第二次變更內容對照表,本書件為初稿本,環保署,變更內容對照表,1030254A
審查中,楊智凱,台9線蘇花公路山區路段改善計畫（蘇澳～東澳、南澳～和平、和中～大清水）第三次環境影響差異分析報告,本書件為修訂本,環保署,差異分析報告,1030243A
審查中,邱景昆,農業生物科技園區開發計畫環境影響說明書第二次土地使用項目變更內容對照表,本書件為修訂本,環保署,變更內容對照表,1030234A
審查中,商維庭,國立成功大學校本部理學教學大樓等二件新建工程,本書件為確認本,環保署,說明書,1030221A
審查中,楊智凱,北宜高速公路工程環境影響評估報告第10次環境影響差異分析報告（坪林行控中心增建機房及電梯）,本書件為初稿本,環保署,差異分析報告,1030213A
審查中,楊智凱,台九線輸油管線汰換工程環境影響說明書,本書件為初稿本,環保署,說明書,1030191A
審查中,邱景昆,南星土地開發計畫-自由貿易港區第一期環境影響說明書第一次變更內容對照表,本書件為修訂本,環保署,變更內容對照表,1030184A
審核修正…,周復仁,高雄市第65期市地重劃區(土地使用分區變更)開發計畫環境影響說明書變更內容對照表,,高雄市,變更內容對照表,1030184X
審查中,邱景昆,彰濱天然氣發電廠興建計畫環境影響說明書第六次變更計畫(配置調整)變更內容對照表,本書件為初稿本,環保署,變更內容對照表,1030174A
審查中,周復仁,高雄市苓雅區五塊厝段2032~2036等5筆地號店鋪、集合住宅大樓新建工程環境影響說明書,,高雄市,說明書,1030171X
審查中,張舜華,嘉寶渡假村開發計畫環境影響說明書變更內容對照表(第三次變更),,高雄市,變更內容對照表,1030164X
審查中,商維庭,高雄新市鎮整體開發環境影響評估報告書第3次環境影響差異分析報告,本書件為確認本,環保署,差異分析報告,1030163A
審查中,周韋儒,桃園市同德段26、27、28、30、31及32地號開發計畫環境影響說明書,,桃園縣,說明書,1030161D
審查中,姜樹成,台中眾鈴汽車有限公司外埔廠區設廠計畫,初稿本,臺中市,說明書,1030161T
審查中,張同婉,中部科學工業園區台中園區第二期發展區擴建計畫（含第一期發展區變更）─臺中市精密機械科技創新園區放流水排入台中園區放流專管排放方案之環境影響差異分析報告,本書件為初稿本,環保署,差異分析報告,1030153A
重辦環評,周韋儒,順倉股份有限公司甲級廢棄物處理機構第二次環境影響差異分析報告(配置變更與處理量調整),,桃園縣,差異分析報告,1030153D
審查中,姜樹成,漢翔航空工業股份有限公司沙鹿北二廠區開發案環境影響說明書,,臺中市,說明書,1030151T
有條件通…,蔡秀美,高雄市鼓山區青海段214地號店鋪、辦公室、集合住宅大樓新建工程環境影響說明書,,高雄市,說明書,1030151X
審查中,邱景昆,第二高速公路後續計畫環境影響評估報告(新竹-南投段)環境影響差異分析報告變更審查結論暨第四次變更內容對照表,本書件為修訂本,環保署,變更內容對照表,1030144A
審查中,高千惠,台中市東山路線道129線(D標末至中興嶺段)拓寬工程變更內容對照表,初稿本,臺中市,變更內容對照表,1030144T
審核修正…,張舜華,臺灣六龜渡假村(原六龜溫泉)環境影響說明書變更內容對照表,,高雄市,變更內容對照表,1030144X
審查中,周韋儒,高速鐵路桃園車站特定區產業專用區開發經營案環境影響說明書,,桃園縣,說明書,1030141D
審查中,邱景昆,中山高速公路新竹-員林段拓寬工程(增設銅鑼交流道)環境影響差異分析報告第一次變更內容對照表,本書件為修訂本,環保署,變更內容對照表,1030134A
審核修正…,周韋儒,亞東石化股份有限公司觀音二廠開發計畫環境影響說明書第二次變更內容對照表(定稿本),1.本案係103年補傳之資料，繳費日期以登記在案之第一次提案審查日期表示。,桃園縣,變更內容對照表,1030134D
審查中,姜樹成,臺中市烏日垃圾資源回收廠環境影響說明書第三次變更內容對照表,初稿本,臺中市,變更內容對照表,1030134T
審查中,周復仁,高雄市苓雅區五塊厝段2032~2036等5筆地號店鋪、集合住宅大樓新建工程環境影響說明書,,高雄市,說明書,1030131X
審查中,邱景昆,水美工程企業股份有限公司觀音資源回收廠變更計畫環境影響說明書變更內容對照表,本書件為修訂本,環保署,變更內容對照表,1030124A
審核修正…,周韋儒,桃園縣桃園市同德段58及59地號開發計畫第二次環境影響差異分析報告,,桃園縣,差異分析報告,1030123D
審查中,蔡秀美,高雄市鼓山區龍中段120 地號興建工程環境影響差異分析報告,,高雄市,差異分析報告,1030123X
審查中,高千惠,臺中市南屯區豐功段257地號新建工程環境影響說明書,初稿本,臺中市,說明書,1030121T
審核修正…,高千惠,臺中市南屯區大進段858地號辦公室及集合住宅新建工程環境影響說明書變更內容對照表,定稿本,臺中市,變更內容對照表,1030114T
,楊智凱,範疇界定:中部科學工業園區第三期發展區（后里基地─七星農場部分）開發計畫環境影響評估報告書,範疇界定會議資料請至本署環評開發論壇下載：http://atftp.epa.gov.tw/EIAforum/Default.aspx?page=NewsList,環保署,評估報告書,1030112A
通過審查…,周韋儒,東和鋼鐵桃園廠擴增產能計畫環境影響說明書(定稿本),1.本案係103年補傳之資料，繳費日期以登記在案之第一次提案審查日期表示。,桃園縣,說明書,1030111D
審查中,張舜華,財團法人高雄法邁內觀中心開發計畫環境影響說明書,,高雄市,說明書,1030111X
審核修正…,高千惠,臺中市南屯區田心段1032地號辦公室及集合住宅新建工程環境影響說明書變更內容對照表,定稿本,臺中市,變更內容對照表,1030104T
審查中,張舜華,長青山莊開發計畫環境影響說明書變更內容對照表,,高雄市,變更內容對照表,1030104X
,陳彥男,範疇界定:淡海新市鎮後期發展區開發案環境影響評估報告書,範疇界定會議資料請至本署環評開發論壇下載：http://atftp.epa.gov.tw/EIAforum/Default.aspx?page=NewsList,環保署,評估報告書,1030102A
審核修正…,周韋儒,昱筌實業股份有限公司乙級廢棄物處理廠環境影響說明書變更內容對照表定稿本,,桃園縣,變更內容對照表,1030094D
審查中,張同婉,高雄都會區鐵路地下化綜合規劃第四次環境影響差異分析報告,本書件為確認本,環保署,差異分析報告,1030093A
審查中,陳心怡,竹北市世興段46、47地號2筆綜合大樓新建工程變更內容對照表,未定稿,新竹縣,說明書,1030091E
審查中,高千惠,臺中市南屯區田心段1061-2等14筆地號店鋪、辦公室及集合住宅新建工程環境影響說明書,初稿本,臺中市,說明書,1030091T
審查中,王美樺,高雄市永安區誠毅紙器工業區開發案環境影響說明書變更內容對照表,,高雄市,變更內容對照表,1030084X
審查中,張同婉,國光電廠興建計畫環境影響差異分析報告,本書件為初稿本,環保署,差異分析報告,1030083A
審核修正…,陳心怡,天陵墓園(原信望愛墓園)開發環境影響差異分析報告,,新竹縣,差異分析報告,1030083E
通過審查…,周韋儒,昇宏桶行有限公司申請甲級廢棄物處理事業機構環境影響說明書(定稿本),1.本案係103年補傳之資料，繳費日期以登記在案之第一次提案審查日期表示。,桃園縣,說明書,1030081D
審查中,姜樹成,臺中市潭子聚興產業園區環境影響說明書,,臺中市,說明書,1030081T
審核修正…,陳心怡,新竹縣竹北市台元段716地號土地廠辦大樓興建工程案環境影響說明書變更內容對照表,未定稿,新竹縣,變更內容對照表,1030074E
審查中,劉馥萱,臺灣地區西部走廊東西向快速公路建設計畫觀音-大溪線第2次環境影響差異分析報告(台66線與桃81、桃79及台31等平交路口改善工程),本書件為初稿本,環保署,差異分析報告,1030073A
審查中,林亞蓁,冠軍建材股份有限公司工廠產能及面積擴增環境影響差異分析報告,,苗栗縣,差異分析報告,1030073F
審查中,周韋儒,鴻曜塑膠工業甲級廢棄物處理廠環境影響說明書,,桃園縣,說明書,1030071D
審查中,姜樹成,臺中市太平產業園區環境影響說明書,,臺中市,說明書,1030071T
審查中,蔡秀美,高雄市鼓山區青海段179~182 地號店鋪、集合住宅大樓新建工程環境影響說明書,,高雄市,說明書,1030071X
審查中,姜樹成,霧峰「電影文化城第貳期」社區環境影響評估報告書,,臺中市,環境現況差異分…,1030065T
審查中,邱景昆,第二高速公路後續計畫環境影響評估報告(新竹-南投段)南投服務區第2次變更內容對照表,本書件為修訂本,環保署,變更內容對照表,1030064A
審查中,林亞蓁,福誼企業股份有限公司甲級廢棄物處理機構環境說明書第二次變更內容對照表,,苗栗縣,變更內容對照表,1030064F
不同意變更,陳心怡,新竹縣新埔鎮自強自辦農村社區土地重劃區開發計畫(替代方案),,新竹縣,差異分析報告,1030063E
通過審查…,周韋儒,研華股份有限公司林口園區擴建工程環境影響說明書,,桃園縣,說明書,1030061D
審查中,陳靖玟,國道十號燕巢交流道延伸高46線銜接186甲線道路工程案開發計畫環境影響說明書,,高雄市,說明書,1030061X
審查中,姜樹成,臺中市龍井區藝術段687地號等11筆土地檢討變更為鄉村區乙種建築用地及適當用地案環境影響說明書變更內容對照表,,臺中市,變更內容對照表,1030054T
審查中,陳心怡,竹東科技商務服務專用區開發案環境影響差異分析報告(第三次變更),,新竹縣,差異分析報告,1030053E
審查中,林亞蓁,長信環保工程有限公司乙級廢棄物處理場處理許可量能擴增計畫環境影響說明書,,苗栗縣,說明書,1030051F
審查中,張舜華,燁民實業股份有限公司熱理廠環境影響說明書,,高雄市,說明書,1030051X
審查中,邱景昆,離島式基礎工業區石化工業綜合區長春關係企業麥寮廠(醋酸/醋酸酐製程緊急安全排放管道之功能與定位)變更內容對照表,本書件為修訂本,環保署,變更內容對照表,1030044A
審查中,黃巧雯,東華大學同仁安居住宅開發計畫第四次變更內容對照表,,花蓮縣,變更內容對照表,1030044P
審查中,高千惠,臺中市污水下水道系統整體規劃環境影響說明書變更內容對照表,,臺中市,變更內容對照表,1030044T
審核修正…,王智弘,高雄市南區資源回收廠(仁武垃圾資源回收廠)環境影響評估報告書變更內容對照表,,高雄市,變更內容對照表,1030044X
審查中,洪明宏,臺北文化體育園區整體規劃案-體育園區第二次環境影響差異分析報告,本書件為初稿本(尚未定稿),臺北市,差異分析報告,1030043W
審查中,陳心怡,致茂品業環保科技股份有限公司乙級廢棄物處理廠開發計畫,未定稿,新竹縣,說明書,1030041E
審查中,林亞蓁,裕隆三義二廠興建案環境影響說明書,,苗栗縣,說明書,1030041F
審核修正…,陳心怡,竹北市世興段52、54地號2筆土地綜合大樓新建工程,,新竹縣,變更內容對照表,1030034E
審核修正…,林亞蓁,寶源科技工業園區環境影響變更內容對照表(第4次),,苗栗縣,變更內容對照表,1030034F
審查中,黃巧雯,花蓮環保科技園區開發工程計畫第2次變更內容對照表,,花蓮縣,變更內容對照表,1030034P
審查中,鄭伊利,泛喬股份有限公司「高雄義大皇冠假日飯店開發計畫」變更內容對照表,,高雄市,變更內容對照表,1030034X
審查中,陳彥男,臺中都會區大眾捷運系統烏日文心北屯線第二次環境影響差異分析報告,本書件為確認本,環保署,差異分析報告,1030033A
審查中,周韋儒,廣豐工商綜合專用區開發計畫環境影響差異分析報告,,桃園縣,差異分析報告,1030033D
審核修正…,姜樹成,輔祥實業股份有限公司永豐廠擴建計畫變更環境影響說明書環境影響差異分析報告(初稿),定稿本,臺中市,差異分析報告,1030033T
審查中,洪明宏,臺北文化體育園區整體規劃案-文化園區環境影響差異分析報告(第二次),本書件為初稿本(尚未定稿),臺北市,差異分析報告,1030033W
審查中,陳渤丰,財團法人玉山寶光聖堂擴建計畫環境影響差異分析暨環境現況差異分析及對策檢討報告,,臺南市,其他,1030028V
審核修正…,陳心怡,新竹縣橫山鄉內灣農村土地重劃環境影響說明書第一次變更內容對照表,未定稿,新竹縣,變更內容對照表,1030024E
審核修正…,王妍方,楊昇建設中正區域城中段開發計畫,,臺北市,變更內容對照表,1030024W
審核修正…,周韋儒,堡富興業股份有限公司乙級廢棄物處理機構擴增處理量第一次環境影響差異分析報告,,桃園縣,差異分析報告,1030023D
審查中,黃巧雯,花蓮廠更新計畫第三次環境影響差異分析報告,,花蓮縣,差異分析報告,1030023P
審查中,姜樹成,輔德高分子股份有限公司產能增設計畫環境影響說明書第二次環境影響差異分析報告(修正稿),定稿本,臺中市,差異分析報告,1030023T
審核修正…,周復仁,中鋼公司第四階段擴建計畫及非方向性矽鋼片投資計畫環境影響差異分析報告(102年第2次變更),,高雄市,差異分析報告,1030023X
審查中,吳聰鈐,宜蘭縣冬山鄉武淵農村社區土地重劃,,宜蘭縣,說明書,1030021C
審查中,賴易正,苑裡廣源科技工業園區開發案環境影響說明書,,苗栗縣,說明書,1030021F
審查中,李正怡,全球人壽-新竹市光武段143、1002地號商業大樓、集合住宅新建工程,,新竹市,說明書,1030021S
徵詢意見…,陳彥男,新北市區域計畫政策評估說明書,本書件為初稿本,環保署,政策評估說明書,1030020A
審查中,洪明宏,克緹信義大樓新建工程環境影響說明書第五次變更內容對照表(第七次變更),,臺北市,變更內容對照表,1030014W
審查中,陳彥男,新竹科學工業園區四期擴建用地竹南科學園區變更計畫暨其擴建計畫第四次環境影響差異分析報告,本書件為修訂本,環保署,差異分析報告,1030013A
審查中,林亞蓁,長春石油化學苗栗廠及苗栗二廠整體暨擴建計畫第2次環境影響差異分析報告,,苗栗縣,差異分析報告,1030013F
審查中,歐玲珠,久明企業有限公司「土石碎解洗選場第一次環境差異分析報告」,,臺東縣,差異分析報告,1030013O
審查中,莊惠如,「麗源建設基隆培德路住宅社區建築計畫」第六次環境影響差異分析報告,,基隆市,差異分析報告,1030013R
審核修正…,潘忠政,臺灣蘭花生物科技園區第1～5期環境影響差異分析報告,,臺南市,差異分析報告,1030013V
審核修正…,蔡秀美,高雄市鼓山區龍中段96等10筆地號辦公室、集合住宅新建工程環境影響差異分析報告,,高雄市,差異分析報告,1030013X
進入二階…,吳聰鈐,綠海包裝利澤工廠興建計畫,說明書件為初稿,宜蘭縣,說明書,1030011C
審查中,陳心怡,台1線替代道路(新豐~新竹公道三、四)工程環境影響說明書,未定稿,新竹縣,說明書,1030011E
審查中,何奇峰,芬園鄉第二座納骨塔興建計畫環境影響說明書,,彰化縣,說明書,1030011H
有條件通…,黃巧雯,花蓮縣花蓮市明義段398地號複合式商場及酒店開發計畫,定稿本,花蓮縣,說明書,1030011P
審查中,李正怡,探索新舍商旅環境影響說明書,,新竹市,說明書,1030011S
審查中,商維庭,萬達鑛業股份有限公司臺濟採字第5310號申請核定及更正核定礦業用地,本書件為初稿本；補正期限：103年5月31日。,環保署,說明書,1021621A
其他,邱景昆,六輕四期擴建計畫環境影響調查報告書-生物毒性試驗之檢測計畫,,環保署,其他,1021618A
審查中,張同婉,北部液化天然氣接收站第二期計畫第一次變更暨原新建計畫第四次變更環境影響差異分析報告,本書件為確認本,環保署,差異分析報告,1021573A
審核修正…,邱景昆,國家生技研究園區開發計畫環境影響說明書變更內容對照表,本書件為定稿本,環保署,變更內容對照表,1021564A
審核修正…,邱景昆,臺北都會區環河快速道路臺北縣側計畫營運監測變更內容對照表,此書件為定稿本,環保署,變更內容對照表,1021544A
審核修正…,邱景昆,湖山水庫下游自來水工程-前處理設備及湖山淨水場環境影響說明書變更內容對照表,本書件為定稿本,環保署,變更內容對照表,1021534A
審查中,劉馥萱,北宜高速公路工程環境影響評估報告第9次環境影響差異分析報告(頭城交流道增設上下匝道改善工程),本書件為確認本,環保署,差異分析報告,1021523A
審查中,張同婉,南部補給油料庫海用油池增建暨壽山作業組油管汰換工程,本書件為初稿本,環保署,說明書,1021511A
審查中,邱景昆,大鵬灣國家風景區BOT開發計畫環境影響說明書第四次變更內容對照表,本書件為修訂本,環保署,變更內容對照表,1021504A
審核修正…,商維庭,高雄都會區大眾捷運系統紅、橘線基本路網第12-1次變更計畫環境影響差異分析報告（紅線南端副維修機廠商業服務區開發）,原名：高雄都會區大眾捷運系統紅、橘線基本路網第十七次變更計畫環境影響差異分析報告（紅線南端副維修機廠商業服務區開發）,環保署,差異分析報告,1021493A
審核修正…,邱景昆,淡水濱海高爾夫球場範圍變更環境影響說明書第三次變更內容對照表,本書件為定稿本,環保署,變更內容對照表,1021484A
徵詢意見…,楊智凱,新設(含擴建)科學園區政策評估說明書,本書件為初稿本;  初審會第一次會議紀錄為103年2月26日公聽會會議紀錄,環保署,政策評估說明書,1021470A
