Status,Taker,Name,Notes,Agency,DocType,Id
審核修正…,邱景昆,中國石油股份有限公司A8601液化天然氣接收站第三期計畫第四次變更環境影響差異分析報告,,環保署,差異分析報告,0911103A
審核修正…,烏曉天,高雄縣岡山垃圾資源回收(焚化)廠灰渣處置地點變更環境影響差異分析報告,繳費日期僅供參考,環保署,差異分析報告,0911093A
審核修正…,張同婉,樹德新校區校園基地開發環境境影響差異分析報告,,環保署,差異分析報告,0911073A
審核修正…,郭博鳴,大潭濱海特定工業區開發計畫施工期間環境監測計畫變更內容對照表,,環保署,變更內容對照表,0911054A
審核修正…,李明昌,西部濱海快速公路建設計畫WH33-1~WH33-4標通灣至苑港（123K+800~130K+905）段路線環境影響差異分析報告,,環保署,差異分析報告,0911043A
審核修正…,彭成熹,台南科學工業區開發計畫變更環境影響差異分析報告(第四次變更),,環保署,差異分析報告,0911033A
審核修正…, ,高雄縣岡山本洲工業區空氣污染總量環境影響差異分析報告,,環保署,差異分析報告,0911023A
審核修正…, ,高雄縣岡山本洲工業區開發計畫環境影響差異分析報告(第三次),,環保署,差異分析報告,0911013A
審核修正…,?,苗栗頭份興隆山莊社區開發案環境影響差異分析報告,,環保署,差異分析報告,0910993A
審核修正…,方偉達,苗栗育達商業技術學院暨造橋學園社區第二次環境影響差異分析報告,,環保署,差異分析報告,0910983A
審核修正…,孫維謙,和平工業區專用港開發計畫環境影響差異分析報告,,環保署,差異分析報告,0910973A
審核修正…,張同婉,中國鋼鐵股份有限公司第四階段擴建計畫及氧氣工場七號機增建計畫環境影響差異分析報告,,環保署,差異分析報告,0910943A
審核修正…,郭博鳴,桃園煉油廠沙崙航燃區環境影響差異分析報告,,環保署,差異分析報告,0910923A
審核修正…, ,淡江大學蘭陽分部（校區）第二次變更環境影響差異分析報告,,環保署,差異分析報告,0910903A
審核修正…, ,大發事業廢棄物處理產廠設置許可變更案環境影響差異分析報告,,環保署,差異分析報告,0910683A
其他,郭博鳴,宜蘭縣私立懷恩殯儀館電化火葬場納骨塔事業環境影響評估報告書變更內容對照表,,環保署,變更內容對照表,0910654A
審核修正…,孫維謙,新竹科學工業園區環境影響調查分析及因應對策報告書,,環保署,其他,0910648A
作成徵詢…, ,台灣地區水資源開發綱領計畫政策評估說明書,,環保署,政策評估說明書,0910630A
有條件通…, ,三芝北投公路環境影響評估報告書,,環保署,評估報告書,0910622A
有條件通…,張同婉,宜蘭大溪蜜月灣地區開發計畫環境影響評估報告書,,環保署,評估報告書,0910612A
有條件通…,謝耀增,經濟部水利署基隆河員山子分洪計畫環境影響因應對策,,環保署,說明書,0910601A
有條件通…,蔡玲儀,西寶水力發電計畫環境影響評估報告書,,環保署,評估報告書,0910582A
有條件通…,張同婉,敬德護理之家籌設案環境影響說明書,,環保署,說明書,0910561A
有條件通…,呂雅雯,國道東部公路花蓮台東段工程規劃環境影響說明書,,環保署,說明書,0910531A
審核修正…,邱景昆,恆春機場整建計畫環境影響差異分析報告,,環保署,差異分析報告,0910483A
有條件通…,李明昌,台二十六線安朔至港口段公路整體改善計畫環境影響評估報告書,,環保署,評估報告書,0910462A
有條件通…,蔡玲儀,觀塘電廠建廠計畫環境影響說明書,,環保署,說明書,0910431A
有條件通…,彭成熹,集集共同引水工程後續計畫--工業用水專用設施沉澱池工程環境影響說明書,有條件通過環境影響評估,環保署,說明書,0910421A
不應開發…,彭成熹,台八線122K+591碧綠及金馬隧道改線工程環境影響說明書,認定不應開發,環保署,說明書,0910411A
有條件通…,張同婉,屏東六塊厝借土區工程環境影響說明書,,環保署,說明書,0910401A
有條件通…,邱景昆,建東礦業股份有限公司為所領台濟採字第5173號大理石礦區申請核定及變更核定礦業用地環境影響說明書,,環保署,說明書,0910381A
有條件通…,邱景昆,桃園大潭液化天然氣接收站專業工業區開發計畫環境影響說明書,,環保署,說明書,0910371A
有條件通…,孫維謙,宏碁智慧園區開發計畫變更案環境影響說明書,,環保署,說明書,0910361A
有條件通…,彭成熹,民間參與台北捷運系統環狀線先期規劃環境影響說明書,,環保署,說明書,0910351A
有條件通…,孫維謙,國立清華大學仙宮校區開發環境影響說明書,,環保署,說明書,0910331A
有條件通…,邱景昆,彰化縣花壇鄉三家春段806等地號土石採取申請案環境影響說明書,有條件通過環境影響評估,環保署,說明書,0910321A
有條件通…,邱景昆,欣欣水泥企業股份有限公司為所領台濟採字第5114號大理石、白雲石礦區申請核定及變更核定礦業用地環境影響說明書,,環保署,說明書,0910311A
有條件通…,烏曉天,台灣中油股份有限公司煉製事業部桃園煉油廠滑油工場興建工程環境影響說明書,,環保署,說明書,0910301A
有條件通…,吳美玲,金崙溫泉(第一期)分區及用地變更計畫案環境影響說明書,有條件通過環境影響評估,環保署,說明書,0910291A
有條件通…,孫維謙,宜蘭冬山衣蝶休閒渡假園區整體開發計畫環境影響說明書,,環保署,說明書,0910281A
有條件通…,彭成熹,台十三線三義外環道新闢工程環境影響說明書,,環保署,說明書,0910261A
有條件通…,孫維謙,花蓮縣鳳林休閒渡假園區開發計畫環境影響說明書,,環保署,說明書,0910251A
有條件通…,彭成熹,台東池上牧野渡假村遊憩區開發案環境影響說明書,,環保署,說明書,0910241A
有條件通…,張同婉,小港空運園區環境影響說明書,,環保署,說明書,0910231A
有條件通…,吳美玲,行政院農業委員會畜產試驗所新竹分所西湖試驗用地整體開發擴大計畫環境影響說明書,有條件通過環境影響評估,環保署,說明書,0910221A
不應開發…,邱景昆,利達礦業股份有限公司宜蘭事業區第72林班地松羅瓷土礦環境影響說明書,,環保署,說明書,0910211A
不應開發…,張同婉,台北捷運系統汐南線之民間參與可行性研究及先期規劃環境影響說明書,,環保署,說明書,0910201A
不應開發…,孫維謙,苗栗縣三義鄉雙草湖段98~141地號等及銅鑼鄉新雞隆段2540地號等土地土石採取聯合申請案環境影響說明書,,環保署,說明書,0910191A
有條件通…,張同婉,朝陽科技大學新增校地開發案環境影響說明書,有條件通過環境影響評估,環保署,說明書,0910161A
有條件通…,孫維謙,財團法人台灣基督教門諾會醫院壽豐分院及老人照顧社區整體開發計畫環境影響說明書,,環保署,說明書,0910151A
有條件通…,吳美玲,行政院農業委員會高雄區農業改良場遷建計畫環境影響說明書,"說明書修正後提會,開發單位於九十一年八月十五日函送補充修正資料經確認",環保署,說明書,0910131A
有條件通…,孫維謙,淳品台北港化油品儲運中心環境影響說明書,,環保署,說明書,0910121A
有條件通…,張秀靜,南投縣私立佳佳花園公墓 環境影響說明書,,南投縣,說明書,0910121I
有條件通…,呂雅雯,大甲溪攔河堰環境影響因應對策環境影響說明書,,環保署,說明書,0910111A
有條件通…,張秀靜,南投縣名間鄉南屏研修院 環境影響說明書,,南投縣,說明書,0910111I
審核通過,張秀靜,原南投縣國姓鄉大旗村九二一災區聚落社區重建計畫 環境影響因應對策,,南投縣,因應對策,0910106I
有條件通…,蔡玲儀,台北縣新店市直潭社區開發計畫環境影響說明書,有條件通過環境影響評估,環保署,說明書,0910101A
有條件通…, ,幸福水泥股份有限公司第一類甲級廢棄物處理機構許可申請環境影響說明書,,環保署,說明書,0910091A
審核通過,張秀靜,南投縣中寮鄉八杞仙段25-1地號等三筆土地變更為鄉村區申請案 環境影響因應對策,,南投縣,因應對策,0910086I
審核修正…,張秀慧,財團法人私立青雲老人安養中心山坡地開發建築變更內容對照表,定稿本,新北市,變更內容對照表,0910084B
有條件通…,吳美玲,國立台灣藝術大學後龍校區校地開發案環境影響說明書,,環保署,說明書,0910081A
有條件通…,周韋儒,大洋塑膠工業股份有限公司桃園新屋鄉大洋工業區(大牛欄段)報編計畫環境影響說明書,1.本案係103年補傳之資料，繳費日期以登記在案之第一次提案審查日期。2.本案通過審查會議紀錄詳見書件目錄C00。,桃園縣,說明書,0910081D
審核通過,張秀靜,南投縣竹文化館及竹文化園區開發許可 環境影響因應對策,,南投縣,因應對策,0910076I
審核修正…, ,東華達觀三、四期環境影響差異分析報告(三),,新北市,差異分析報告,0910073B
審核修正…,周韋儒,中華映管股份有限公司申請龍潭工業園區報編計畫環境影響差異分析報告(定稿本),1.本案係103年補傳之資料，繳費日期以登記在案之第一次提案審查日期。2.本案通過審查會議紀錄詳見書件目錄A11。,桃園縣,差異分析報告,0910073D
有條件通…,彭成熹,大林煉油廠興建汽電共生設備環境影響說明書,,環保署,說明書,0910071A
審核修正…,周韋儒,大江紡織中壢廠區工商綜合區開發計畫環境影響差異分析報告(定稿本),1.本案係103年補傳之資料，繳費日期以登記在案之第一次提案審查日期。,桃園縣,差異分析報告,0910063D
進入二階…,彭成熹,花蓮海洋公園A區範圍擴大(第四次)計畫環境影響說明書,,環保署,說明書,0910061A
審核修正…,郭殷碩,南化鄉南陽聖堂修道院興建計畫環境影響說明書差異分析報告,,臺南縣,差異分析報告,0910053L
有條件通…,謝宏松,台北縣林口鄉南勢埔段申設工商綜合區整體規劃,定稿本,新北市,說明書,0910051B
有條件通…,周韋儒,大溪山莊開發計畫環境影響說明書(定稿本-二版),1.本案係103年補傳之資料，繳費日期以登記在案之第一次提案審查日期。2.本案通過審查會議紀錄詳見書件目錄A09。,桃園縣,說明書,0910051D
有條件通…,姜樹成,台中市鼓勵公民營機構興建營運垃圾焚化廠（第二座垃圾焚化廠）計畫,,臺中市,說明書,0910051T
審核修正…,姜樹成,中港晶華B1至9F商場部份變更案環境影響差異分析,,臺中市,差異分析報告,0910043T
有條件通…,呂雅雯,遠東雲林國際賽車場開發計畫環境影響說明書,,環保署,說明書,0910041A
有條件通…, ,板橋站前高峰會大樓環境影響說明書,定稿本,新北市,說明書,0910041B
有條件通…,周韋儒,昇捷桃園中正路辦公大樓新建工程環境影響說明書(定稿本),1.本案係103年補傳之資料，繳費日期以登記在案之第一次提案審查日期。2.本案通過審查會議紀錄詳見書件目錄C00。,桃園縣,說明書,0910041D
有條件通…,郭殷碩,臺南縣龍崎鄉中坑子段0599地號納骨堂開發計畫環境影響、分析及因應對策書面報告,,臺南縣,說明書,0910041L
審核通過,張秀靜,南投縣國姓鄉福龜段三六0地號九二一震災鄉村區重建環境影響因應對策,,南投縣,因應對策,0910036I
審核修正…, ,國立聯合大學八甲校區開發計畫環境影響說明書變更內容對照表,,環保署,變更內容對照表,0910034A
審核修正…,周韋儒,楊梅高山頂勞工住宅社區環境影響差異分析報告(定稿本),1.本案係103年補傳之資料，繳費日期以登記在案之第一次提案審查日期。2.本案通過審查會議紀錄詳見書件目錄C00。,桃園縣,差異分析報告,0910033D
有條件通…,孫維謙,國立聯合大學八甲校區開發計畫環境影響說明書,,環保署,說明書,0910031A
有條件通…,謝宏松,台北縣八里鄉真慶宮新建計畫,定稿本,新北市,說明書,0910031B
有條件通…,郭殷碩,愛文山土石方資源堆置場設置開發計畫環境影響說明書,,臺南縣,說明書,0910031L
有條件通…,莊惠如,基隆市安樂區武嶺段汽車旅館新建案,,基隆市,說明書,0910031R
有條件通…,姜樹成,台中市政府第二處垃圾衛生掩埋場興建計劃(西屯區場址),定稿本,臺中市,說明書,0910031T
有條件通…,邱景昆,曾文水庫越域引水計畫環境影響評估報告書,定稿本未核定（審查結論未能公告）,環保署,評估報告書,0910022A
有條件通…, ,東雲保長坑廠房新建工程,定稿本,新北市,評估報告書,0910022B
審查中,王宇萱,大園鄉衡山段衡山小段等兩筆地號丁建變甲建案,,桃園縣,說明書,0910021D
有條件通…, ,新竹生活圈公道五延伸新闢(向東)工程,說明書定稿本,新竹縣,說明書,0910021E
有條件通…,張秀靜,南投縣埔里鎮大瑪璘段地號330等四筆土地鄉村區整體規劃開發案 環境影響說明書,,南投縣,說明書,0910021I
有條件通…,郭殷碩,南盛隆興業有限公司第一類乙級廢棄物處理場環境影響說明書,,臺南縣,說明書,0910021L
有條件通…,莊惠如,基隆市中山區德安段商場新建工程及相關雜項工程環境影響說明書,,基隆市,說明書,0910021R
有條件通…,姜樹成,第二處垃圾衛生掩埋場興建計劃(北屯區場址),定稿本,臺中市,說明書,0910021T
審核修正…,薛富美,幸福水泥股份有限公司第一類甲級廢棄物處理機構環境影響說明書,,宜蘭縣,其他,0910018C
審核通過,張秀靜,南投縣鹿谷鄉內湖國民小學校園重建工程 環境影響因應對策,,南投縣,因應對策,0910016I
審查中,林芳津,"佛陀山孝道法門開發工程環境影響評估報告書
變更開發工程配置計畫
變更內容對照表",,苗栗縣,變更內容對照表,0910014F
審核修正…, ,新竹縣區域性焚化爐(BOO)拔子窟廠,差異分析定稿本,新竹縣,差異分析報告,0910013E
審核修正…,陳淑梅,彰化市東側外環道路新闢工程路線規劃環境影響差異分析報告,,彰化縣,差異分析報告,0910013H
退件/撤銷,溫修慧,行政院衛生署玉里醫院祥和復健園區擴大建院計畫環境影響說明書,"未於期限內補正,本署於92/1/20函請行政院衛生署駁回開發行為許可之申請。",環保署,說明書,0910011A
有條件通…,謝宏松,國賓陶瓷資源回收廠新建工程,,新北市,說明書,0910011B
審查中,王宇萱,林口工五工業區,,桃園縣,說明書,0910011D
有條件通…,郭殷碩,普捷企業股份有限公司第一類乙級廢棄物處理場,,臺南縣,說明書,0910011L
有條件通…,唐淑蓉,花蓮縣豐濱鄉垃圾衛生掩埋場環境影響說明書(定稿本),定稿本,花蓮縣,說明書,0910011P
有條件通…,莊惠如,基隆富貴社區新建工程環境影響說明書(定稿本)（恒源興建設公司）,,基隆市,說明書,0910011R
有條件通…,曾文慧,新竹市公道五延伸新闢道路(向西)工程,,新竹市,說明書,0910011S
有條件通…,姜樹成,台中市第二處垃圾衛生掩埋場興建計劃(南屯區場址),定稿本,臺中市,說明書,0910011T
有條件通…,王玲英,東湖地區聯外山區線道路環境影響說明書,,臺北市,說明書,0910011W
審核修正…,孫維謙,海湖發電計畫修正廢水處理量環境影響差異分析報告,因資料缺漏，故繳費日期僅供參考,環保署,差異分析報告,0903053A
審核修正…,-,碧志企業有限公司廢棄物處理機構甲級事業廢棄物處理環境影響差異分析報告,由於資料太老舊，故承辦人、繳費日期、目的事業主管機關別僅供參考,環保署,差異分析報告,0903043A
審核修正…,-,自翔工業有限公司廢棄物處理機構甲級事業廢棄物處理環境影響差異分析報告,由於資料太老舊，故承辦人、繳費日期、目的事業主管機關別僅供參考,環保署,差異分析報告,0903033A
審核修正…,-,勤仲企業有限公司廢棄物處理機構甲級事業廢棄物處理環境影響差異分析報告,由於資料太老舊，故承辦人、繳費日期、目的事業主管機關別僅供參考,環保署,差異分析報告,0903023A
審核修正…,邱景昆,彰濱天然氣發電廠興建計畫環境影響差異分析報告,,環保署,差異分析報告,0903013A
審核修正…,孫維謙,和平火力發電廠開發計畫廢污水放流利用變更環境影響差異分析報告,,環保署,差異分析報告,0903003A
其他,吳美玲,北宜高速公路坪林行控中心專用道開放為一般交流道環境影響差異分析報告,,環保署,差異分析報告,0902993A
審核修正…, ,申請變更「海湖發電計畫」海湖發電廠至中壢一次變電所161仟伏輸電線路徑變更內容對照表,,環保署,變更內容對照表,0902984A
審核修正…,吳美玲,麥寮六輕焚化爐、掩埋場及灰塘變更計劃環境影響差異分析報告,,環保署,差異分析報告,0902973A
審核修正…,何文淵,雲林離島式基礎工業區麥寮區設置試驗性風力發電裝置計畫環境影響差異分析報告,,環保署,差異分析報告,0902963A
審核修正…,彭成熹,新竹科學工業園區四期擴建用地竹南基地環境影響差異分析報告,,環保署,差異分析報告,0902953A
有條件通…, ,新店安康一般事業廢棄物掩埋場興建工程環境影響說明書,,環保署,說明書,0902931A
審核修正…,蔡玲儀,核能四廠第一、二號機發電計畫循環冷卻水系統變更設計環境影響差異分析報告,,環保署,差異分析報告,0902923A
審核修正…, ,櫻花歐洲村住宅社區開發計畫環境影響差異分析報告,,環保署,差異分析報告,0902913A
審核修正…, ,第二高速公路後續計畫站區廢棄物處理方式變更環境影響差異分析報告,,環保署,差異分析報告,0902893A
審核修正…,蔡玲儀,彰化濱海工業區開發計畫開發內容暨審查結論變更環境影響差異分析報告,,環保署,差異分析報告,0902873A
審核修正…, ,嘉益工業股份有限公司申請工業區編定計畫環境影響差異分析報告,,環保署,差異分析報告,0902863A
審核修正…,彭成熹,澎湖尖山火力發電計畫用地配置變更內容對照表,,環保署,變更內容對照表,0902854A
審核修正…,蔡玲儀,核能四廠第一、二號機發電計畫廠區配置變更案說明資料,,環保署,其他,0902848A
審核修正…,蔡玲儀,核能四廠第一、二號機發電計畫運轉前之環境資料蒐集計畫中環境輻射偵測變更內容對照表,,環保署,變更內容對照表,0902834A
審核修正…,孫維謙,桃園科技工業區開發變更計畫環境影響差異分析報告,,環保署,差異分析報告,0902803A
審核修正…,彭成熹,新竹科學工業園區四期擴建用地竹南基地環境影響差異分析報告,,環保署,差異分析報告,0902753A
審核修正…,邱景昆,信大關西社區整體開發建築計畫環境影響差異分析報告,,環保署,差異分析報告,0902733A
審核修正…,孫維謙,「台灣積體電路製造股份有限公司晶圓十二廠及世界先進積體電路股份有限公司晶圓二廠計畫」環境影響差異分析報告,,環保署,差異分析報告,0902713A
審核修正…,彭成熹,澎湖尖山電廠擴建計劃環境影響差異分析報告,,環保署,差異分析報告,0902703A
審核修正…,蔡玲儀,大潭燃氣火力發電計畫環境影響差異分析報告,,環保署,差異分析報告,0902693A
審核修正…,張同婉,北宜高速公路頭城蘇澳段工程環境影響差異分析報告,,環保署,差異分析報告,0902673A
審核修正…,邱景昆,A8601液化天然氣接收站第三期計畫第三次環境影響差異分析報告,,環保署,差異分析報告,0902663A
審核修正…,張同婉,馬公機場民航站區擴建工程環境影響差異分析報告書,,環保署,差異分析報告,0902653A
審核修正…, ,財團法人國泰綜合醫院汐止分院分館第二次環境影響差異分析報告,,環保署,差異分析報告,0902623A
審核修正…,孫維謙,月眉育樂世界開發計畫環境影響差異分析報告(主題園區主題旅館設施面積調整案),,環保署,差異分析報告,0902613A
審核修正…,黃雅絢,台南科學工業區開發計畫變更環境影響差異分析報告,,環保署,差異分析報告,0902603A
審核修正…, ,馬偕護理專科學校校區整體開發建築計畫環境現況差異分析及對策檢討報告,,環保署,其他,0902588A
審核修正…,陳昭旭,高雄縣岡山工業區開發計畫污水處理方案變更環境影響差異分析報告,,環保署,差異分析報告,0902573A
其他, ,明道管理學院整體開發計畫環境影響差異分析報告,,環保署,差異分析報告,0901473A
審核修正…,何文淵,淡水小坪頂社區整體開發建築計畫環境影響差異分析報告,,環保署,差異分析報告,0901463A
審核修正…,孫維謙,嘉惠電廠開發計畫第二次環境影響差異分析報告(定稿本),,環保署,差異分析報告,0901453A
審核修正…,黃雅絢,阿公店水庫更新改善計畫環境影響調查報告書,,環保署,環境調查報告,0901447A
審核修正…,蔡玲儀,核能四廠第1、2號機發電計畫環境影響調查報告書,因資料過於老舊繳費日期僅供參考,環保署,環境調查報告,0901437A
作成徵詢…, ,高爾夫球場設置之政策評估說明書,,環保署,政策評估說明書,0901420A
作成徵詢…, ,工業區設置方針政策評估說明書,,環保署,政策評估說明書,0901410A
有條件通…,呂雅雯,新竹科學工業園區第四期擴建用地銅鑼基地開發計畫環境影響評估報告書,,環保署,評估報告書,0901402A
有條件通…,張同婉,棕梠湖山莊變更開發計劃環境影響對照說明書,,環保署,說明書,0901391A
有條件通…, ,億昇倉儲企業股份有限公司彰濱倉儲儲槽新建工程環境影響說明書,,環保署,說明書,0901381A
審核通過, ,國立東勢高工新建校區環境影響因應對策,,環保署,因應對策,0901376A
進入二階…,蔡玲儀,西寶水力發電計畫環境影響說明書,,環保署,說明書,0901361A
有條件通…, ,竹東鎮第四公墓改善工程環境影響說明書,,環保署,說明書,0901341A
有條件通…, ,和桐化學股份有限公司台中港西七碼頭後線儲槽工程環境影響說明書,,環保署,說明書,0901331A
進入二階…,彭成熹,國道五號公路台東太麻里段工程環境影響說明書,,環保署,說明書,0901321A
有條件通…,蔡玲儀,桃園都會區大眾捷運系統規劃環境影響評估報告書,,環保署,評估報告書,0901302A
有條件通…,呂雅雯,高平磊晶科技股份有限公司新建廠環境影響說明書,,環保署,說明書,0901271A
有條件通…, ,省道台十九甲線拓寬改善計畫環境影響說明書,,環保署,說明書,0901261A
有條件通…,孫維謙,嘉南藥理科技大學(嘉南藥理學院)第二校區開發計畫環境影響說明書,,環保署,說明書,0901171A
有條件通…,張同婉,安平漁港舊港口重建計畫環境影響說明書,,環保署,說明書,0901161A
有條件通…,孫維謙,馬祖福澳碼頭擴建環境影響說明書,,環保署,說明書,0901151A
有條件通…,邱景昆,高鳳技術學院環境影響說明書,,環保署,說明書,0901121A
有條件通…,彭成熹,大中鋼鐵股份有限公司南投廠工業區報編案環境影響評估報告書,,環保署,評估報告書,0901112A
有條件通…,孫維謙,聯華電子股份有限公司力行廠區擴增產能計畫環境影響說明書,,環保署,說明書,0901101A
有條件通…,邱景昆,國立台北科技大學第二校區開發案環境影響說明書,,環保署,說明書,0901091A
有條件通…,孫維謙,台灣積體電路製造股份有限公司台南廠區擴廠計畫環境影響說明書,,環保署,說明書,0901081A
有條件通…,呂雅雯,霧峰工業區開發計畫環境影響說明書,,環保署,說明書,0901061A
有條件通…,孫維謙,高雄醫學大學屏東校區開發案環境影響說明書,,環保署,說明書,0901051A
審核修正…,方偉達,「中華映管股份有限公司申請龍潭工業園區報編計畫開發計畫暨可行性規劃報告配置調整變更」變更內容對照表,,環保署,變更內容對照表,0901044A
有條件通…, ,中華映管股份有限公司申請龍潭工業園區報編計畫環境影響說明書,,環保署,說明書,0901041A
有條件通…,吳美玲,平鎮淨水場第二原水抽水站工程環境影響說明書,,環保署,說明書,0901031A
有條件通…,張同婉,長昌電力股份有限公司燃氣電廠新建工程(龜山南崁頂段)環境影響說明書,,環保署,說明書,0901021A
有條件通…,蔡玲儀,中區事業廢棄物綜合處理中心環境影響說明書,,環保署,說明書,0901011A
不應開發…,張同婉,國立台北商業技術學院第二校區（通霄校區）環境影響說明書,,環保署,說明書,0901001A
