Status,Taker,Name,Notes,Agency,DocType,Id
有條件通…,莊惠如,「基隆市暖暖區源遠段365 地號等4 筆土地集合住宅工程」環境影響說明書,,基隆市,說明書,0970071R
有條件通…,姜樹成,台中市南屯區田心段892地號集合住宅新建工程,定稿本,臺中市,說明書,0970071T
有條件通…,林志芳,中國信託新總行大樓新建工程環境影響說明書,,臺北市,說明書,0970071W
審核修正…,周韋儒,亞洲楊梅社區整體開發建築計畫環境影響說明書結論二變更，環境影響差異分析暨環境現況差異分析及對策檢討報告(定稿本),1.本案係103年補傳之資料，繳費日期以登記在案之第一次提案審查日期。2.本案通過審查會議紀錄詳見書件目錄C00。,桃園縣,環境現況差異分…,0970065D
審核修正…,張盈瑄,南投縣私立普台高級中學整體開發計畫環境影響第二次變更內容對照表,,環保署,變更內容對照表,0970064A
審核修正…,薛富美,台灣水泥股份有限公司蘇澳廠廢棄物處理機構申請計畫,,宜蘭縣,變更內容對照表,0970064C
審核修正…,郭殷碩,崑陵山安樂園環境影響說明書變更內容對照表,,臺南縣,變更內容對照表,0970064L
審核修正…,莊惠如,「基隆市信義區深澳段65 等6 筆地號住宅社區興建開發案」環境影響變更內容對照表,,基隆市,變更內容對照表,0970064R
審核修正…,林志芳,華新信義大樓新建工程第二次變更內容對照表,,臺北市,變更內容對照表,0970064W
審核修正…,黃亭蓉,曼哈頓金融大廈新建工程案環境影響差異分析報告,,新北市,差異分析報告,0970063B
審核修正…,曾聿穎,苗栗縣頭份區域性一般廢棄物處理場第二次環境影響差異分析報告,,苗栗縣,差異分析報告,0970063F
審核修正…, ,「中鋼公司第四階段擴建計畫及冷軋廠興建計劃」案環境影響差異分析報告書,,高雄市,差異分析報告,0970063X
有條件通…,李世偉,千禧園汽車旅館環境影響說明書,說明書定稿本,新竹縣,說明書,0970061E
有條件通…, ,裕鐵企業股份有限公司工業區用編定開發計畫,,高雄市,說明書,0970061M
審查中,曾文慧,擬訂新竹市都市計畫(新竹機場附近地區)環境影響說明書,,新竹市,說明書,0970061S
有條件通…,姜樹成,台中市西屯區惠民段74地號集合住宅新建工程,定稿本,臺中市,說明書,0970061T
審核修正…,林志芳,華新信義大樓新建工程變更內容對照表,,臺北市,變更內容對照表,0970054W
審核修正…,張同婉,彰化濱海工業區開發計畫審查結論8.變更環境影響差異分析報告(放流水排放標準調整),,環保署,差異分析報告,0970053A
審核修正…,黃亭蓉,山圓建設股份有限公司板橋文化路新建工程第二次環境影響差異分析報告,定稿本,新北市,差異分析報告,0970053B
審核修正…,陳義昇,財團法人台灣省臺南縣學甲慈濟宮附設公墓（納骨塔及公墓公園化）環境影響差異分析報告,,臺南縣,差異分析報告,0970053L
審核修正…,曾文慧,新竹市貿易二村貿易八村新建工程,,新竹市,差異分析報告,0970053S
有條件通…,周韋儒,東和鋼鐵公司辦理桃園廠遷廠及工業區報編計畫環境影響說明書(定稿本),1.本案係103年補傳之資料，繳費日期以登記在案之第一次提案審查日期。2.本案通過審查會議紀錄詳見書件目錄A(18)。,桃園縣,說明書,0970051D
有條件通…,楊棻蘭,新竹縣芎林都市計劃(第三次通盤檢討)農業區變更住宅區暫予保留案,說明書定稿本,新竹縣,說明書,0970051E
有條件通…,曾聿穎,苑裡東西向南橫公路工程環境影響說明書,,苗栗縣,說明書,0970051F
有條件通…,吳銘彬,春映寶來溫泉度假山莊開發計畫,,高雄市,說明書,0970051M
有條件通…,莊惠如,「基隆市信義區培德段471 地號住宅社區開發計畫」環境影響說明書,,基隆市,說明書,0970051R
有條件通…,姜樹成,台中市南屯區豐富段146、147、148、149、149-1、150地號店鋪辦公室及集合住宅大樓興建工程,定稿本,臺中市,說明書,0970051T
有條件通…, ,「高雄市前鎮區獅甲段250-3地號等三筆土地興建工程」案環境影響說明書,,高雄市,說明書,0970051X
審核修正…,曾聿穎,造橋鄉第一公墓納骨堂興建計畫環境影響差異分析報告及因應對策,,苗栗縣,其他,0970048F
審核修正…,邱景昆,八里國際高爾夫球場申請停止環境監測計畫變更內容對照表,本書件為定稿本,環保署,變更內容對照表,0970044A
有條件通…,顏佳慧,私立長永紀念福園,原名稱為林口特定區〈工十二細部計畫〉殯葬設施專區興建工程,新北市,說明書,0970041B
有條件通…,周韋儒,祐杰建設國聖段二十一層超級市場，集合住宅新建工程案環境影響說明書(定稿本),1.本案係103年補傳之資料，繳費日期以登記在案之第一次提案審查日期。,桃園縣,說明書,0970041D
有條件通…,楊棻蘭,竹北市台元段廠辦大樓新建工程,說明書定稿本,新竹縣,說明書,0970041E
有條件通…,郭殷碩,臺南縣私立康寧教養院環境影響說明書,,臺南縣,說明書,0970041L
有條件通…,吳銘彬,國蘭溫泉山莊發計畫,,高雄市,說明書,0970041M
有條件通…,莊惠如,「基隆市中正區調和段八斗子自辦市地重劃案」環境影響說明書,,基隆市,說明書,0970041R
有條件通…,曾文慧,崇華堂天恩道院非都市土地申請作宗教建築使用環境影響說明書,,新竹市,說明書,0970041S
有條件通…,姜樹成,台中市南屯區惠禮段5地號店舖及集合住宅新建工程環境影響說明書,定稿本,臺中市,說明書,0970041T
有條件通…,鄧淞駿,臺北市大安區金華段2小段963等地號住宅大樓新建工程環境影響說明書,,臺北市,說明書,0970041W
有條件通…, ,「高雄市鼓山區龍中段120、120-1、129-1 地號興建工程」環境影響說明書,,高雄市,說明書,0970041X
審核修正…,孫維謙,日月潭九族文化村相關環境影響評估書件變更內容對照表(九族端纜車場站設置計畫),,環保署,變更內容對照表,0970034A
審核修正…,薛富美,建惠企業社宜蘭縣南澳鄉武塔段土地申請陸上土石採取計畫,,宜蘭縣,變更內容對照表,0970034C
審核修正…,陳義昇,財團法人台灣省臺南縣學甲慈濟宮附設公墓（納骨塔及公墓公園化）環境影響說明書變更內容對照表,,臺南縣,變更內容對照表,0970034L
審核修正…,王玲英,大安機房及線中大樓新建工程環境影響說明書變更內容對照表,,臺北市,變更內容對照表,0970034W
審核修正…,曾聿穎,苗栗縣中二高(台六線與台十三線)連絡道路新闢工程環境影響差異分析報告,,苗栗縣,差異分析報告,0970033F
審核修正…, ,高雄市苓雅區新田路集合住宅大樓興建工程環境影響差異分析報告書,,高雄市,差異分析報告,0970033X
審查中,張秀慧,新店市灣潭自辦市地重劃區重劃案,,新北市,說明書,0970031B
有條件通…,周韋儒,桃園龜山兔子坑住宅社區開發計畫環境影響說明書(定稿本),1.本案係103年補傳之資料，繳費日期以登記在案之第一次提案審查日期。2.本案通過審查會議紀錄詳見書件目錄C00。,桃園縣,說明書,0970031D
有條件通…,張秀靜,投17線0K+640~21K+000(草屯鎮~中寮鄉)道路拓寬改善工程 環境影響說明書,,南投縣,說明書,0970031I
有條件通…,吳銘彬,國蘭花園溫泉開發計畫,,高雄市,說明書,0970031M
有條件通…,莊惠如,「基隆市中正區調和段242、242-4、242-5 共3 筆地號開發案」環境影響說明書,,基隆市,說明書,0970031R
有條件通…,曾文慧,新竹市東光段土地開發案環境影響說明書,,新竹市,說明書,0970031S
有條件通…,姜樹成,台中市西屯區惠民段132、133地號店鋪及集合住宅大樓新建工程環境影響說明書,定稿本,臺中市,說明書,0970031T
審核修正…,張同婉,屏東縣六塊厝農場設置加工出口區計畫環境影響說明書審查結論變更暨第二次環境影響差異分析報告,,環保署,差異分析報告,0970023A
審核修正…,顏佳慧,林口特定區工十二工業區第一期(南亞科技晶圓廠及南亞印刷電路板廠)開發計畫差異分析報告,定稿本,新北市,差異分析報告,0970023B
審核修正…,王玲英,市政府轉運站新建工程變更設計環境影響差異分析報告,,臺北市,差異分析報告,0970023W
有條件通…,周韋儒,桃園縣龜山鄉兔子坑綠色銀行休閒農場開發計畫環境影響說明書(定稿本),1.本案係103年補傳之資料，繳費日期以登記在案之第一次提案審查日期。2.本案通過審查會議紀錄詳見書件目錄C00。,桃園縣,說明書,0970021D
有條件通…,楊棻蘭,新竹縣竹北市世興段53地號店鋪、辦公室、住宅新建工程,說明書定稿本,新竹縣,說明書,0970021E
有條件通…,曾聿穎,苗62-1號道路(清安至新興道路)未完成路段興建計畫環境影響說明書,,苗栗縣,說明書,0970021F
退件/撤銷,陳淑梅,彰化縣大城鄉殯葬綜合區開發計畫,依環境影響評估法第13條之1規定，開發單位未於期限內補正，99年4月9日函請目的事業主管機關駁回開發行為許可之申請，目的事業主管機關於99年4月12日函文駁回開發申請。,彰化縣,說明書,0970021H
有條件通…,張秀靜,147線0K+000~14K+500道路拓寬及橋樑改建工程 環境影響說明書,,南投縣,說明書,0970021I
有條件通…,陳義昇,"台灣蘭花生物科技園區第四,五期土地開發環境影響說明書",,臺南縣,說明書,0970021L
有條件通…,張舜華,天闊溫泉會館開發計畫,,高雄市,說明書,0970021M
有條件通…,譚仲萍,屏東縣獅子鄉丹路段978-1號等10筆原住民保留地建築用地開發計畫環境影響說明書,,屏東縣,說明書,0970021N
有條件通…,曾文慧,新竹市東區溪橋自辦農村社區土地重劃環境影響說明書,,新竹市,說明書,0970021S
有條件通…,姜樹成,台中市西屯區惠國段36地號店鋪及集合住宅大樓新建工程環境影響說明書,定稿本,臺中市,說明書,0970021T
有條件通…,李建緯,「高雄市鼓山區龍中段27地號興建工程」環境影響說明書,,高雄市,說明書,0970021X
審核修正…,曾聿穎,天帝教天安太和道場環境影響評估報告書變更內容對照表,,苗栗縣,變更內容對照表,0970014F
審核修正…,陳淑梅,彰化縣大村鄉過溝農村社區土地重劃開發計畫變更內容對照表,,彰化縣,變更內容對照表,0970014H
審核修正…,唐淑蓉,花蓮環保科技園區開發計畫變更內容對照表,定稿本,花蓮縣,變更內容對照表,0970014P
重辦環評,張瑞芸,大林煉油廠汽柴油品質改善暨潤滑基礎油工場興建計畫環境影響差異分析報告,,環保署,差異分析報告,0970013A
審核修正…,黃朝琴,嘉義縣民雄鄉垃圾衛生掩埋場環境影響差異分析報告,基地面積7.1公頃,嘉義縣,差異分析報告,0970013K
有條件通…, ,合桐建設新店市寶強段589 地號住商大&#63820;新建工程案,定稿本,新北市,說明書,0970011B
有條件通…,薛富美,東鴻進龍德廢棄物處理廠興建工程環境影響說明書,,宜蘭縣,說明書,0970011C
有條件通…,周韋儒,桃園市同德段56、57地號店鋪、辦公室、集合住宅新建工程環境影響說明書(定稿本),1.本案係103年補傳之資料，繳費日期以登記在案之第一次提案審查日期。2.本案歷次通過審查會議紀錄詳見書件目錄A11。,桃園縣,說明書,0970011D
有條件通…,李世偉,新竹縣芎林鄉金獅自辦農村社區土地重劃區,說明書定稿本,新竹縣,說明書,0970011E
有條件通…,蘇君紋,漢翔航空工業股份有限公司沙鹿北廠區4.13公頃土地開發案,,臺中縣,說明書,0970011G
有條件通…,張秀靜,南投縣鹿谷鄉慈照寺地藏院興建計畫 環境影響說明書,,南投縣,說明書,0970011I
有條件通…, ,三玉一般事業廢棄物最終處置場 環境影響說明書,,雲林縣,說明書,0970011J
有條件通…,陳義昇,台灣蘭花生物科技園區第三期土地開發環境影響說明書,,臺南縣,說明書,0970011L
有條件通…,吳銘彬,華榮電線電纜股份有限公司高楠廠工商綜合區開發規劃案,,高雄市,說明書,0970011M
有條件通…,譚仲萍,屏東縣來義鄉第九公墓開發計畫環境影響說明書,,屏東縣,說明書,0970011N
有條件通…,莊惠如,「基隆市安樂區武嶺段大武崙自辦市地重劃區案」環境影響說明書,,基隆市,說明書,0970011R
有條件通…,曾文慧,新竹市東區水源自辦農村社區土地重劃環境影響說明書,,新竹市,說明書,0970011S
有條件通…,黃富美,台中市北區乾溝子段155-19等11地號店鋪及集合住宅新建工程環境影響說明書,定稿本,臺中市,說明書,0970011T
審查中,簡祐靜,台北市中正區臨沂段二小段363地號等27筆土地集合住宅新建工程環境影響說明書,,臺北市,說明書,0970011W
有條件通…, ,「高雄市鹽埕區大成段300、364地號觀光旅館大樓工程」環境影響說明書,,高雄市,說明書,0970011X
有條件通…,黃富美,台中市西屯區上石碑段1779-4等11筆地號集合住宅新建工程環境影響說明書,定稿本,臺中市,說明書,0970001T
審核修正…, ,「龍港風力發電計畫機組開發計畫環境影響說明書暨龍港工業園區開發計畫增設風力發電機組環境影響差異分析報告」開發主體變更說明及相關附件,,環保署,其他,0961528A
審核修正…,吳美玲,高雄都會區大眾捷運系統紅、橘線基本路網環境影響評估-第四次剩餘土石方運送地點及運輸路線調整變更內容對照表(古蹟遺址調查報告及教育訓練),,環保署,變更內容對照表,0961514A
審核修正…,張瑞芸,通霄土城段山坡地住宅社區開發環境現況差異分析及對策檢討報告,,環保署,環境現況差異分…,0961475A
審核修正…,張瑞芸,通霄土城段山坡地住宅社區開發環境影響差異分析報告,,環保署,差異分析報告,0961463A
審核修正…,張同婉,大路觀遊樂區開發計畫環境影響差異分析報告,,環保署,差異分析報告,0961453A
審核修正…,張同婉,台中市精密機械科技創新園區開發計畫環境影響評估報告書審查結論變更暨環境影響差異分析報告,,環保署,差異分析報告,0961443A
進入二階…,張瑞芸,大安大甲溪水源聯合運用輸水工程計畫環境影響說明書,,環保署,說明書,0961431A
審核修正…,何文淵,嘉惠電廠開發計畫第四次環境影響差異分析報告,,環保署,差異分析報告,0961423A
審核修正…,石秉鑫,台南科學工業園區二期基地開發暨原台南科學工業園區變更計畫(專28用地分割變更)變更內容對照表,,環保署,變更內容對照表,0961414A
其他,孫維謙,嘉義醫療專用區土方資源利用變化環境影響差異分析報告,"1.本書件為初稿本。
2.教育部、行政院衛生署及嘉義縣政府轉送財團法人長庚紀念醫院申請撤回本案，本署業於98年1月23日以環署綜字第0980007888號函同意辦理。",環保署,差異分析報告,0961403A
有條件通…,何文淵,宜蘭羅東堰下游供水計畫清洲淨水廠新建工程環境影響說明書,,環保署,說明書,0961381A
審核修正…,張同婉,新竹科學工業區四期擴建用地銅鑼基地開發計畫環境影響差異分析報告,,環保署,差異分析報告,0961373A
其他,張盈瑄,新竹科學工業園區龍潭基地(替代方案)開發計畫有達光電既有廠房部分租予達信科技變更內容對照表,本書件為初稿本,環保署,變更內容對照表,0961364A
退件/撤銷,張瑞芸,苗栗縣後龍科技園區環境影響說明書,本書件為初稿本；本案依據102年2月8日環署綜字第1020013386號函駁回。,環保署,說明書,0961351A
審核修正…,張瑞芸,國道6號南投段增設舊正及北山交流道環境影響差異分析報告,,環保署,差異分析報告,0961343A
審核修正…,張盈瑄,匯僑股份有限公司台中港西五號碼頭後線儲槽新建工程環境影響說明書變更內容對照表,,環保署,變更內容對照表,0961334A
審核修正…,張瑞芸,嘉義大埔美智慧型工業園區開發計畫書環境影響差異分析報告,本書件為初稿本,環保署,差異分析報告,0961323A
審核修正…,何文淵,曾文水庫越域引水下游輸水工程環境影響差異分析暨環境現況差異分析及對策檢討報告,,環保署,差異分析報告,0961313A
審核修正…,張盈瑄,中山高速公路汐止五股段高架拓寬工程環境說明書(國道一號五股交流道改善工程)變更內容對照表,,環保署,變更內容對照表,0961304A
審核修正…,石秉鑫,全國高爾夫球場環境影響說明書第二次變更內容對照表,本案採書面審查方式辦理，無專案小組會議紀錄。,環保署,變更內容對照表,0961294A
審核修正…,石秉鑫,基隆市東岸聯外道路工程環境影響評估報告書第二次變更內容對照表,,環保署,變更內容對照表,0961284A
審核修正…,石秉鑫,『新竹科學工業園區環境影響調查分析及因應對策報告書』暨『新竹科學工業園區篤行營區開發計畫環境影響說明書』變更內容對照表-變更土地使用計畫及污水廠廢水來源規劃,,環保署,變更內容對照表,0961274A
審核修正…,張盈瑄,淡水海濱高爾夫球場範圍變更環境影響說明書變更內容對照表,,環保署,變更內容對照表,0961264A
審核修正…,石秉鑫,星元天然氣發電廠興建計畫環境影響說明書第二次變更內容對照表,本案係採書面審查方式辦理。,環保署,變更內容對照表,0961244A
審核修正…,何文淵,南部科學工業園區管理局高雄園區土地使用計畫及廢棄物處理方式變更環境影響差異分析報告,,環保署,差異分析報告,0961223A
審核修正…,張同婉,豐坪溪及其支流水力發電開發計畫環境現況差異分析及對策檢討報告,,環保署,差異分析報告,0961213A
審核修正…,張瑞芸,遠東雲林國際賽車場開發計畫環境現況調查差異分析報告及對策檢討報告,,環保署,環境現況差異分…,0961195A
有條件通…,何文淵,國立臺灣大學竹北分部開發環境影響說明書,,環保署,說明書,0961181A
審核修正…,何文淵,湖山水庫工程計畫環境影響調查報告書,,環保署,環境調查報告,0961167A
有條件通…,何文淵,幸福水泥股份有限公司所領台濟採字第4873號大理石礦白雲石礦採礦權申請核定礦業裝卸設施用地環境影響說明書(替代方案),,環保署,說明書,0961151A
審核修正…,何文淵,湖山水庫工程計畫生態保育措施,此書件為定稿本,環保署,其他,0961148A
其他,張同婉,彰化濱海工業區開發計畫審查結論13.變更內容對照表(變更廢棄物處理方式),,環保署,變更內容對照表,0961134A
審核修正…,何文淵,亞洲楊梅社區整體開發建築計畫環境影響說明書審查結論二變更、環境影響差異分析暨環境現況差異分析及對策檢討報告,,環保署,差異分析報告,0961123A
其他,石秉鑫,國光電廠興建計畫環境影響說明書環境監測計畫第一次變更內容對照表,本案變更內容對照表退回，請開發單位先確認國光電廠第二期擴建計畫是否開發，及該計畫環境監測計畫之執行與本案銜接性，再重依程序送審。,環保署,變更內容對照表,0961114A
審核修正…,石秉鑫,新竹科學工業園區園區三、五路沿線土地開發計畫環境影響說明書變更內容對照表-變更排水系統,,環保署,變更內容對照表,0961104A
有條件通…,何文淵,國道一號五股至楊梅段拓寬工程可行性研究替代方案環境影響說明書,,環保署,說明書,0961091A
有條件通…,何文淵,國立成功大學歸仁校區擴增校地計畫環境影響說明書,,環保署,說明書,0961081A
審核修正…,石秉鑫,第二高速公路後續計畫環境影響評估(南投-新營段) 變更內容對照表,,環保署,變更內容對照表,0961074A
不同意變更,陳妙玲,新竹科學工業園區四期擴建用地銅鑼基地開發計畫環境影響評估報告書變更內容對照表,本書件為初稿本,環保署,變更內容對照表,0961064A
審核修正…,陳妙玲,台灣積體電路製造股份有限公司台南廠區擴廠計畫環境影響說明書第三次變更內容對照表,,環保署,變更內容對照表,0961054A
審核修正…,張同婉,台南縣善化鎮曾文工業區變更內容對照表,,環保署,變更內容對照表,0961044A
審核修正…,張同婉,第二高速公路後續計畫新營屏東段(配合高屏地區及經濟部吉洋人工湖砂石運輸道路工程)環境影響差異分析報告書,,環保署,差異分析報告,0961033A
審核修正…,張同婉,中華映管股份有限公司龍潭工業區報編計畫-第二次毗連土地作臨時性使用申請案變更內容對照表,,環保署,變更內容對照表,0961024A
審核修正…,張同婉,龍潭工業園區報編計畫第二次毗連土地作臨時性使用申請案變更內容對照表,,環保署,變更內容對照表,0961014A
審核修正…,張同婉,雲林科技工業區開發計畫大北勢區土地使用局部調整計畫第二次變更內容對照表,,環保署,變更內容對照表,0961004A
審核修正…,孫維謙,桃園科技工業園區開發變更計畫環境影響說明書變更內容對照表,,環保署,變更內容對照表,0960994A
其他,孫維謙,宏碁智慧園區開發計畫環境影響調查報告書,本書件為初稿本,環保署,環境調查報告,0960987A
審核修正…,孫維謙,茂德科技竹科廠擴增產能計畫--環境影響差異分析報告,,環保署,差異分析報告,0960973A
審核通過,張瑞芸,基隆市污水下水道系統第一期實施計畫-和平島污水處理廠排放調查分析及因應對策,,環保署,因應對策,0960966A
審核修正…,張瑞芸,台北都會區環河快速道路台北縣側建設計畫(第七、八、九標)環境影響差異分析報告,,環保署,差異分析報告,0960933A
審核修正…,張同婉,屏東車城國際觀光旅館開發計畫環境現況差異分析及差異分析報告,,環保署,差異分析報告,0960923A
審核修正…,張同婉,東西向快速公路後龍汶水線-增設右轉匝道工程環境影響差異分析報告,,環保署,差異分析報告,0960913A
審核修正…,張同婉,聯華山莊社區建築配置局部調整變更內容對照表,,環保署,變更內容對照表,0960894A
審核修正…,張瑞芸,國立高雄第一科技大學環境影響差異分析報告(第二次變更),,環保署,差異分析報告,0960873A
審核修正…,張瑞芸,臺七縣羅浮至棲蘭段拓寬改善計畫－蘇樂橋災害復建環境影響差異分析報告,,環保署,差異分析報告,0960863A
有條件通…,何文淵,西濱快速公路(台61線)員林大排至西濱大橋新建工程計畫環境影響說明書,,環保署,說明書,0960851A
退件/撤銷,周復仁,省道台8線116K+400等五處彎道改善環境影響說明書,本書件為初稿本；於97年9月9日以環署綜字第0970069007號函請目的事業主管機關駁回,環保署,說明書,0960841A
其他,何文淵,國立故宮博物院南部分院籌建計畫環境影響差異分析報告(原為國立故宮博物院南部分院籌建計畫環境影響說明書變更內容對照表),本書件為初稿本;本案認定應改提環境影響差異分析報告,環保署,變更內容對照表,0960834A
審核修正…,黃亭蓉,鶯歌鎮高職西街集合住宅新建工程變更內容對照表,定稿本,新北市,變更內容對照表,0960824B
審核修正…,張瑞芸,農業生物科技園區開發計畫第二次環境影響差異分析報告,,環保署,差異分析報告,0960823A
其他,石秉鑫,湖山水庫工程計畫環境影響評估報告書變更內容對照表,本書件為初稿本；退請開發單位考量提出環境影響差異分析報告書，或重新撰寫變更內容對照表依程序送審。,環保署,變更內容對照表,0960814A
審核修正…,顏佳慧,德盛開發股份有限公司淡海新市鎮公司田段192地號集合住宅新建工程環境影響說明書變更內容對照表,,新北市,變更內容對照表,0960814B
審核修正…,石秉鑫,台南縣柳營科技工業區開發計畫環境影響評估報告書變更內容對照表(局部調整土地使用配置),,環保署,變更內容對照表,0960804A
審核修正…,顏佳慧,華鼎建設三重市大仁段964、965、966及967地號集合住宅社區開發案環境影響差異分析報告,,新北市,差異分析報告,0960803B
審核修正…,何文淵,財團法人國泰綜合醫院汐止分院本館環境影響差異分析變更內容對照表,,環保署,變更內容對照表,0960794A
審核修正…,顏佳慧,台北縣八里鄉真慶宮新建計畫環境影響說明書變更內容對照表,,新北市,變更內容對照表,0960794B
審核修正…,黃亭蓉,曼哈頓金融大廈新建工程案環境影響說明書第二次變更內容對照表,,新北市,變更內容對照表,0960774B
